ticker_symbol,company_name,tweet_id,writer,post_date,body,comment_num,retweet_num,like_num,reaction_total
TSLA,Tesla Inc,1126197394767581184,markbspiegel,2019-05-08,"wow, a ton of $tsla borrow opened up today. thanks, elon, for printing all those fresh shares!",4,4,74,82
TSLA,Tesla Inc,1126224183724318722,markbspiegel,2019-05-08,the only other public company i know of that loses tens (or hundreds) of millions of dollars a year selling used cars is... wait for it... $tsla!,0,0,3,3
TSLA,Tesla Inc,1126230448101703680,gerberkawasaki,2019-05-08,have an appointment with the audi etron on friday morning. will be giving the full review after. excited to drive this new ev and compare it to the best. $tsla #tesla,33,9,187,229
TSLA,Tesla Inc,1126237027660439553,markbspiegel,2019-05-08,"""weird that people buy $tsla when so many good automaker stocks (beyond $tsla) are available!""",3,0,31,34
TSLA,Tesla Inc,1126237324709249024,teslacharts,2019-05-08,now do $tsla,0,0,9,9
TSLA,Tesla Inc,1126240263632969729,gerberkawasaki,2019-05-08,you wonder why they attack tesla relentlessly. #big #oil #money $tsla,3,20,68,91
TSLA,Tesla Inc,1126241351656398854,gerberkawasaki,2019-05-08,it's as if my soul mate took over the @tesla twitter. $tsla,11,4,113,128
TSLA,Tesla Inc,1126247985799729152,markbspiegel,2019-05-08,"hi hope,exactly what data is $tsla supposedly collecting, how much bandwidth is it using to supposedly transmit it all back to hq, and what exactly is it supposedly doing with it?  thanks in advance for your answers to all these questions!",1,0,10,11
TSLA,Tesla Inc,1126251948930404352,markbspiegel,2019-05-08,"it's actually hilarious that the ceo of a $40b public company can claim that his rapidly depreciating, least-reliable-car-on-the-market shitboxes are ""appreciating assets""!#tesla $tsla$tslaq",5,2,76,83
TSLA,Tesla Inc,1126317349085147136,gerberkawasaki,2019-05-09,"audi e-tron customers face more delivery delays, fines for canceled orders: can they #scale ... $tsla #tesla  https://apple.news/axov7cnjrqkkcnviilsltla…",8,3,33,44
TSLA,Tesla Inc,1126432323057139713,markbspiegel,2019-05-09,"""tesla performance vehicles have limited power for months due to software 'bug"" https://electrek.co/2019/05/09/tesla-performanc-limited-power-software-bug/…want to bet it's intentional due to shredded drivetrains? this company is a joke.$tslaq$tsla",8,9,62,79
TSLA,Tesla Inc,1126434724971466752,pluginfud,2019-05-09,but it's a software company bro$tsla $tslaq,1,4,23,28
TSLA,Tesla Inc,1126485272634515456,pluginfud,2019-05-09,hey @elonmusk we're badly in need of a pump over here$tsla $tslaq,7,0,35,42
TSLA,Tesla Inc,1126547502667268101,pluginfud,2019-05-09,$tsla to $4000/sh,0,0,4,4
TSLA,Tesla Inc,1126588598025949184,markbspiegel,2019-05-09,"i recently put on 5 shorts, all around 1/8th the size of our $tsla short: $nflx, $w,  $sq, $tlry and $cvna. ironically, the only one we're not up on is cvna. (maybe that's why i'm tweeting about it, lol.)",5,1,25,31
TSLA,Tesla Inc,1126619749071433729,markbspiegel,2019-05-09,we are now at the point where $tsla must die so others may live.$tslaq,4,3,50,57
TSLA,Tesla Inc,1126630347876081664,gerberkawasaki,2019-05-09,uber going for $45. bottom of range. with fully diluted value over $80 bil. keep in mind tesla is valued about half that with $30 bil in rev and will eat uber with fsd. $tsla $uber,19,19,187,225
TSLA,Tesla Inc,1126640923142524928,gerberkawasaki,2019-05-10,tesla model 3 receives stellar 5-star rating from premier uk auto magazine $tsla  https://apple.news/aq_0-vvifqwuct7kbsdqtkq…,7,13,98,118
TSLA,Tesla Inc,1126670451499880448,pluginfud,2019-05-10,"finally got my mainstream article on this. friendship ended with dana hull, craig is new bestt friend.$tsla $tslaq",4,1,40,45
TSLA,Tesla Inc,1126862947018350594,vincent13031925,2019-05-10,“i was wrong about the #tesla model 3 | sold my chevy volt ! “great video to watch $tsla,4,12,78,94
TSLA,Tesla Inc,1126866386888871936,markbspiegel,2019-05-10,"""help us out on this $tsla equity deal at $243 and next week we'll let you buy some $45 $uber!""",3,7,69,79
TSLA,Tesla Inc,1126870462569431040,vincent13031925,2019-05-10,bought more $tsla today,17,10,242,269
TSLA,Tesla Inc,1126878412751065088,vincent13031925,2019-05-10,$uber has $72b market cap vs $tsla only $42b ?! what a joke.,43,40,510,593
TSLA,Tesla Inc,1126889003280547841,vincent13031925,2019-05-10,"so now @tesla became more affordable and able to benefit from selling to the bigger majority of people is a bad thing?? @elonmusk is doing what he promised us years ago, making model 3 more pricing friendly to most of us. $tsla",58,46,410,514
TSLA,Tesla Inc,1126895204101808128,vincent13031925,2019-05-10,"panasonic expects to see higher yields from gigafactory 1 as operations get optimized, and there could be a potential upside in model s and x demand as tesla takes actions to make its flagship vehicles more attractive to consumers. $tsla #tesla",4,25,145,174
TSLA,Tesla Inc,1126906911666819072,vincent13031925,2019-05-10,"breaking: tesla model 3 has arrived taiwan (officially) for the final homologation testing. thanks @elonmusk , seems like it’s ahead of ur original schedule (again). congrats to m3 owners in #taiwan @teslaownerstwn $tsla #tesla #taiwan #model3pix via my follower in tw",18,51,323,392
TSLA,Tesla Inc,1126924105071173634,markbspiegel,2019-05-10,"if you're dumb enough to believe ""the $tsla autonomy story"" but not smart enough to grasp the implications of the complete overhaul of the team trying to develop it, then...you're even dumber than ""dumb enough.""$tslaq",4,4,136,144
TSLA,Tesla Inc,1126924403969798146,markbspiegel,2019-05-10,"that's the first honesty i've ever seen from the $tsla ir site...i mean, if you're ron baron or baillie gifford, it's not a safe site!",1,0,30,31
TSLA,Tesla Inc,1126947179531198464,gerberkawasaki,2019-05-10,"the audi etron can not compete with tesla on any level. not speed, not performance, range, technology or price!. the model 3 is half the cost as the etron and twice as good. so far between the ipace and etron, they dont come close to anything tesla is doing. $tsla",16,18,96,130
TSLA,Tesla Inc,1126947484855443461,gerberkawasaki,2019-05-10,"both the ipace and etron are a good start and once again, im happy the other players are trying. but they arnt trying that hard. its clear. tesla has no one near them for years to come. the tech is so far superior to any car anywhere in the world. $tsla",8,18,108,134
TSLA,Tesla Inc,1126947934061207552,gerberkawasaki,2019-05-10,hopefully porsche has a better attempt than jag and audi. but these are expensive cars with little range and no technology. im happy to say tesla is so far ahead in every category. etron is nice and im sure audi buyers will buy it. but its inferior to tesla. $tsla,5,6,60,71
TSLA,Tesla Inc,1126948450975621120,gerberkawasaki,2019-05-10,even the guy at audi said the charging issue is an issue. standard being used by audi is just not available anywhere. no where to charge. with tesla you can charge anywhere. tesla has adapters for all types charging stations but other car companies don't have the adapters. $tsla,6,10,64,80
TSLA,Tesla Inc,1126948983786491904,gerberkawasaki,2019-05-10,couldn't wait to drive my model 3 after driving the audi etron. it's just so much better. nice start for audi but no thanks. #tesla $tsla,9,13,126,148
TSLA,Tesla Inc,1126951174928785410,markbspiegel,2019-05-10,"and europe and china will be lower than april. so this is consistent with worldwide may $tsla deliveries being flat-to-down slightly vs. april. lol, re 90-100,000 for the quarter!$tslaq",4,0,23,27
TSLA,Tesla Inc,1126951332538044416,gerberkawasaki,2019-05-10,they also made it way better to buy a tesla. hope they keep putting on all those ads during the playoffs because it will help tesla. all the new evs and their commercials help tesla. $tsla,7,3,55,65
TSLA,Tesla Inc,1126967142656745472,markbspiegel,2019-05-10,"my guess is that the lower asps in q2 will offset the non-repeating one-time charges from q1 and thus tesla will lose almost as much money, with the difference being <$100m thanks to slightly better q2 unit sales. so for now, let's call the q2 $tsla gaap loss around $650m.",4,2,27,33
TSLA,Tesla Inc,1126967988110782464,vincent13031925,2019-05-10,"just found out my neighbor (workplace) also bought a tesla model 3, now charging! $tsla",3,3,121,127
TSLA,Tesla Inc,1126983990752071680,gerberkawasaki,2019-05-10,listen german car companies. it’s not about making an ev version of your car.  it’s about the brain. the technology you put in the car. that’s the future. smart cars. it’s nice it’s ev but you’re think about this wrong. #tesla is the king. $tsla,36,42,235,313
TSLA,Tesla Inc,1126988845310935045,vincent13031925,2019-05-10,that’s “y” i ordered now waiting on my @tesla model y $tsla,3,5,113,121
TSLA,Tesla Inc,1127004327279833089,teslacharts,2019-05-11,1/ it is time to check in on the state of demand with $tsla using the tc magic eight ball $tslaq,2,12,96,110
TSLA,Tesla Inc,1127004330081554432,teslacharts,2019-05-11,3/ the mix of rwd vs awd hitting nmvtis has held steady at >70% for the past several weeks. this is a very poor mix for $tsla margins. $tslaq,2,0,42,44
TSLA,Tesla Inc,1127008882163732481,gerberkawasaki,2019-05-11,"tesla battery partner panasonic sees higher gigafactory output, cites model s/x demand increase - $tsla  https://apple.news/adue-9h3iqf68efwigdnw-a…",3,13,76,92
TSLA,Tesla Inc,1127016486780973061,markbspiegel,2019-05-11,"at #autoshanghai dieter zetsche announced another all-electric compact suv: the eqb will be available in china from 2021 on.#daimler #emobility(mercedes-benz eqc 400 | stromverbrauch kombiniert: 20,8 – 19,7 kwh/100 km; co2-emissionen kombiniert: 0 g/km)[*]",2,0,15,17
TSLA,Tesla Inc,1127016603445370881,vincent13031925,2019-05-11,"“tesla full self driving will be cross-country capable this year”looking forward to fsd feature, already bought it$tsla #tesla #fullselfdriving",8,25,166,199
TSLA,Tesla Inc,1127209505400295426,gerberkawasaki,2019-05-11,tesla is not even in the same league as the competition in evs and autonomous driving. we’ll have to wait for rivian and porsche taycan to see the next attempts. going to be a while... ipace and etron are weak. $tsla,19,15,189,223
TSLA,Tesla Inc,1127244225114820609,gerberkawasaki,2019-05-11,don't want to buy a car? rent your neighbor's. this is going to be big time. we looked at turo the other day. very cool company. $tsla,18,6,46,70
TSLA,Tesla Inc,1127254862490689536,teslacharts,2019-05-11,"according to the $tsla 2025 bonds, which are pari passu to the new 2024 converts, the raise basically didn't happen.$tslaq",8,5,106,119
TSLA,Tesla Inc,1127283774121750528,markbspiegel,2019-05-11,"just read anderson's barron's interview. that guy is one naive, no-homework mf-er. he still thinks $tsla is ""6-7 years ahead of the rest of the industry"" (have you driven an i-pace, james? or a taycan?) & talks about $baba & tencent without one word re scammy chinese accounting.",12,4,61,77
TSLA,Tesla Inc,1127550640127979520,markbspiegel,2019-05-12,"""long road toward driverless future"" http://enewspaper.latimes.com/infinity/article_share.aspx?guid=46f0be96-e57a-4215-b48d-9183332cb161…apparently, unlike the ceo of $tsla, the ceo of $uber isn't a pathological liar/securities fraudster",7,8,72,87
TSLA,Tesla Inc,1127586972221038593,markbspiegel,2019-05-12,"so a $tsla salesperson is telling a prospective buyer that right now teslas have ""full self-driving"" on the highway (& soon in cities) & neither @ftc nor @nhtsagov gives a flying fuck. hey, i have an idea: let's slash the budget deficit by whatever those useless agencies cost us!",2,1,39,42
TSLA,Tesla Inc,1127587757398818816,markbspiegel,2019-05-12,"seeing as $tsla has billions of dollars in accumulated losses, what good does the tax credit do it without a profitable leasing partner? (perhaps it has one, heretofore unrevealed.)",0,0,7,7
TSLA,Tesla Inc,1127606151858802688,markbspiegel,2019-05-12,"and oh, approximately $16,000 less than the cheapest $tsla model x... $23,000 less in the u.s in january with a tax credit #tesla won't have....",13,11,70,94
TSLA,Tesla Inc,1127609859527122945,markbspiegel,2019-05-12,"all joking aside, the biggest thing i (and fraud-boy) learned in this whole $tsla adventure is that designing a cool car is the easy part;  building, distributing & servicing millions of them profitably & at consistently high quality is ""the moat."" now musk is panicking.$tslaq",3,2,18,23
TSLA,Tesla Inc,1127611951960535040,markbspiegel,2019-05-12,"$tsla equity is worthless, so $0.00. but in reality this thing might be another $mnkd that perpetually raises money on new stories by issuing tens of millions of shares in the low single digits and maybe we'll never have to cover & realize the gain.",3,0,13,16
TSLA,Tesla Inc,1127684406095663104,gerberkawasaki,2019-05-12,"the tesla effect is reaching critical mass, and it could put big oil on the defensive. the one way you can make a dramatic difference in your carbon footprint. buy an ev and tesla is the best by miles. $tsla  https://apple.news/ahcmhet43ttcbihj3rnxhsg…",6,15,90,111
TSLA,Tesla Inc,1127905082970968064,markbspiegel,2019-05-13,"""volvo's polestar brand intensifies tesla challenge with 'powerful little beast"" https://europe.autonews.com/automakers/volvos-polestar-brand-intensifies-tesla-challenge-powerful-little-beast…this car will destroy what's left of $tsla model 3 sales in its largest european market of norway.$tslaq",1,6,21,28
TSLA,Tesla Inc,1127929592348647424,markbspiegel,2019-05-13,"""2nd rear drive unit in as many years"" https://teslamotorsclub.com/tmc/threads/2nd-rear-drive-unit-in-as-many-years.152497/… ""they explained that rear drive units are on backorder...people with issues from 3/19 have yet to receive new drive units.""but i'm sure the $tsla warranty reserve is just fine.$tslaq",10,6,35,51
TSLA,Tesla Inc,1127939463131406338,markbspiegel,2019-05-13,"i don't make jokes about larry ellison-- too much respect for the business that guy built. i write off his $tsla & theranos involvement to being small relative to his net worth and thus ""not paying attention."" i doubt he'll repeat those mistakes.",2,0,9,11
TSLA,Tesla Inc,1127964088989048832,markbspiegel,2019-05-13,based on the stock fraud-boy borrowed against as of 12/31 it's theoretically possible for him to post additional $tsla shares without getting liquidated until the $110s but we don't know his current borrowings as the recent deal prospectus only showed those from banks on the deal,3,0,7,10
TSLA,Tesla Inc,1127982885506404352,pluginfud,2019-05-13,is $tsla going to $tslaq because you've run the company like a crackhead for the past 2 years?,3,3,37,43
TSLA,Tesla Inc,1127988981600272385,pluginfud,2019-05-13,hey @elonmusk now would be a great day to cut (the insanely unachievable) guidance you've put out and maintained for q2 and 2019i doubt the market will even notice!$tsla $tslaq,3,2,60,65
TSLA,Tesla Inc,1128023269456506880,gerberkawasaki,2019-05-13,got to give elon credit for grabbing the money when he had the chance. did a lot better than uber. $tsla $uber,45,17,266,328
TSLA,Tesla Inc,1128055395346288640,pluginfud,2019-05-13,"you're a scumbag, @elonmusk. but that's not new news to anyone other than your soyboy lemmings in sv$tsla $tslaq",0,6,45,51
TSLA,Tesla Inc,1128056781245165570,markbspiegel,2019-05-13,this is a material amount of money for a company on the financial balls of its ass like $tsla. now let's see if it emboldens all those other abused workers suing them...$tslaq,2,3,31,36
TSLA,Tesla Inc,1128067273112133634,markbspiegel,2019-05-13,"lots of aging $tsla inventory spotted at mt. kisco, ny: 70 mostly model 3s & s's outside + lord knows how many inside. the guy who sent me this said a truck driver told him they have hundreds stored at mannheim with dead batteries! time for another inventory write-down?$tslaq",14,16,90,120
TSLA,Tesla Inc,1128068963097694209,pluginfud,2019-05-13,full-sized scoop (particularly the 2nd sentence). potentially even a two scoops in a waffle cone $tsla $tslaq,0,0,12,12
TSLA,Tesla Inc,1128082178724622336,vincent13031925,2019-05-13,tesla shanghai gigafactory gf3  5-12-2019 update via & credit : https://youtu.be/x5avbritayq$tsla #tesla #china #teslachina #gf3,27,88,547,662
TSLA,Tesla Inc,1128111247344513025,pluginfud,2019-05-14,"""how many credit default swaps do you own??""somewhere up there in the god-tier of $tslaq, i hope someone's been holding a few $tsla cdss.",2,0,19,21
TSLA,Tesla Inc,1128117847035645958,pluginfud,2019-05-14,long thesis:$tsla $tslaq,7,1,51,59
TSLA,Tesla Inc,1128275784056156160,teslacharts,2019-05-14,wakes up. checks model s in europe. still dead. ergo $tsla is still insolvent. grabs a few more minutes of sleep. $tslaq,7,25,145,177
TSLA,Tesla Inc,1128278232736915461,markbspiegel,2019-05-14,"lol, as @passthebeano said earlier, this kind of tweet barrage is exactly what fraud-boy does before a disastrous $tsla earnings report!",5,2,24,31
TSLA,Tesla Inc,1128291866120740866,pluginfud,2019-05-14,"discounts are back!$8,500 off a tesla model 3 performance.never pay full price!$tsla $tslaq",6,4,38,48
TSLA,Tesla Inc,1128292873944883200,pluginfud,2019-05-14,"don't worry, discounts are available on model s and x too!here's a nice racecar red model s 100d, given a new home (next to a p100d ) for the low low price of $67,450. $tsla $tslaq",3,2,28,33
TSLA,Tesla Inc,1128310354491129856,pluginfud,2019-05-14,"""new"" model s (75d) cheaper than a new model 3 (p3d, tho)model s might crack the $60k barrier soon... cc @28delayslater $tsla $tslaq",3,1,18,22
TSLA,Tesla Inc,1128322050085593090,pluginfud,2019-05-14,"hey @elonmusk whats the deal with new s/x orders? you know, the way better refreshed version?do you need to clear out the old ones first? did you need to log some orders for your bankers to pitch the cap raise? what gives? people want their cars!$tsla $tslaq",3,0,16,19
TSLA,Tesla Inc,1128330070668521473,pluginfud,2019-05-14,"built tent tough, designed in california for californiansmodel 3 rusting out after 6,000 miles. $tsla $tslaq#teslaqualityissues#teslapaintissueshttps://forums.tesla.com/forum/forums/rust-1…",8,8,40,56
TSLA,Tesla Inc,1128331344336052227,markbspiegel,2019-05-14,"apparently not. but hey, don't let that stop you from paying $6000 today for ""full-self-driving"" that #tesla claims already exists on highways and will exist in cities later this year.$tsla$tslaq#giantfraud",2,1,14,17
TSLA,Tesla Inc,1128340223614525440,gerberkawasaki,2019-05-14,tesla is valued around half of uber yet it does almost three times the revenue and is about cash flow neutral now. go figure. $tsla $uber,76,110,807,993
TSLA,Tesla Inc,1128347891322499072,pluginfud,2019-05-14,another tesla crash caused by autopilot.fsd and robotaxis coming soon though. right @elonmusk ?$tsla $tslaq https://teslamotorsclub.com/tmc/threads/crashed-advice-needed.152601/…,5,9,47,61
TSLA,Tesla Inc,1128351697787473920,vincent13031925,2019-05-14,came to visit the chiropractor and easily found 5 tesla in the corner of the parking lot. $tsla #tesla #model3 #models,15,7,167,189
TSLA,Tesla Inc,1128383194611404800,vincent13031925,2019-05-14,"“tesla vandals laugh as they damage a model 3 while sentry mode is actively recording”still can’t understand why some people are doing such a stupid thing, destroy others’ assets just for fun. thanks for @tesla’s sentry mode. $tsla",22,30,216,268
TSLA,Tesla Inc,1128387704784412673,teslacharts,2019-05-14,$nio's gonna love that new factory that is being built in shanghai with $tsla's money. $tslaq,3,1,49,53
TSLA,Tesla Inc,1128421807063752704,markbspiegel,2019-05-14,"""2020 mercedes-benz eqc first drive: equalizing luxury"" https://insideevs.com/reviews/349606/mercedes-benz-eqc-first-drive/?utm_source=rss&utm_medium=referral&utm_campaign=rss-all-…should be around $60,000 in the u.s. after the tax credit. bye bye $tsla model x.",4,2,38,44
TSLA,Tesla Inc,1128451333495906304,pluginfud,2019-05-15,$tsla is worth $4.20/share,0,0,18,18
TSLA,Tesla Inc,1128636635996930048,pluginfud,2019-05-15,"4/ in the last few days (from late last week), discounts have spiked. for new ms, extra discounts are now $6-7k, for mx, $7-7.5k on average for the cars tracked. interestingly, 3's are rarely offered, and with negligible discounts.",0,0,2,2
TSLA,Tesla Inc,1128668567539527681,markbspiegel,2019-05-15,trump postponing european tariffs is actually very bad news for $tsla.  tesla's european sales are rapidly heading into the toilet anyway so counter-tariffs wouldn't affect it anywhere near as much as would u.s. tariffs on european evs about to destroy tesla in its home market.,4,6,52,62
TSLA,Tesla Inc,1128690166133080064,markbspiegel,2019-05-15,"""student drives tesla through la tutoring center; no injuries reported"" https://losaltosonline.com/news/sections/news/200-police-fire/59801-student-drives-tesla-through-la-tutoring-center-no-injuries-reported#.xnw2aj2mtre.twitter…if this happened after school with classes in session, $tsla would be immediately shut down and out of business.",13,12,51,76
TSLA,Tesla Inc,1128696673604124672,pluginfud,2019-05-15,i do not approve of this crossover meme.$tsla $tslaq $spaceq,1,1,30,32
TSLA,Tesla Inc,1128759477212196864,pluginfud,2019-05-15,took a like nap. didn't miss my stop. $tsla to go down 4.20% tomorrow,1,0,4,5
TSLA,Tesla Inc,1128794037073244160,gerberkawasaki,2019-05-15,"more than 2 million electric vehicles sold in 2018, evs expected to make up 57% of all sales by 2040 - tesla $tsla",6,7,48,61
TSLA,Tesla Inc,1128810060690415617,teslacharts,2019-05-15,"it was, and may he stay unemployed for a good long time. when scumbags like this think $tsla is too slimy, the end is near. $tslaq",4,7,88,99
TSLA,Tesla Inc,1128821705713963008,gerberkawasaki,2019-05-16,tesla will now be employing a more effectively communication strategy. we’re hoping for much more positive engagement in the media as well. excited for this change. #tesla $tsla,15,12,135,162
TSLA,Tesla Inc,1128822598115028993,gerberkawasaki,2019-05-16,soros fund management increases stake in tesla convertible bonds: #tesla $tsla,19,29,103,151
TSLA,Tesla Inc,1128827129829953536,teslacharts,2019-05-16,i hereby commit to a $500 donation to the charity of your choice if you can produce an audio recording of @elonmusk storming off the spacex call today after being asked about the crew dragon explosion. $tslaq $tsla,21,31,190,242
TSLA,Tesla Inc,1128862212162957312,gerberkawasaki,2019-05-16,wow. super impressive. tesla. the fastest car on the road. $tsla,34,62,316,412
TSLA,Tesla Inc,1129006273280774145,markbspiegel,2019-05-16,"well, it's official: pro-forma in another $15m or so of $tsla quarterly gaap losses! https://sec.gov/archives/edgar/data/319815/000031981519000035/mxwl03311910q.htm…$mxwl",5,5,38,48
TSLA,Tesla Inc,1129007875341377540,markbspiegel,2019-05-16,"so for 899,000 newly-issued shares $tsla picked up around $5m in net cash (assuming $mxwl burned $5m so far in q2) + $15m in quarterly gaap losses. that's like issuing $tsla stock @ $5.56/share before the losses even begin, lol.$tslaq",7,7,54,68
TSLA,Tesla Inc,1129016529218023425,gerberkawasaki,2019-05-16,tesla exceeds employment goals for ny as giga 2 starts supercharger v3 production. tesla continues to grow. $tsla  https://apple.news/ao3mqxsupr-olz6aoy-srpa…,14,15,164,193
TSLA,Tesla Inc,1129021862657384448,markbspiegel,2019-05-16,"holy shit, is this a model 3 fire??? can anyone verify that this is real?#tesla$tsla",7,4,19,30
TSLA,Tesla Inc,1129047577876467712,markbspiegel,2019-05-16,"i just shorted even more $tsla, this time in the $229s. i completely agree with @tommythornton that the stock should be down 20% on the autopilot death story. i think the nhtsa (& other countries!) could (& should!) ban that dangerous kluge at any moment.$tslaq",25,8,140,173
TSLA,Tesla Inc,1129074036460392448,markbspiegel,2019-05-16,"what day does the sanitation department pick up on wall street? i thought it was thursday afternoon, but maybe it's friday? i have all this garbage that needs to be sent to landfills somewhere: $tsla $sq $cvna $nflx $tlry $w",8,0,37,45
TSLA,Tesla Inc,1129101458723487746,markbspiegel,2019-05-16,"wait, i've got one:  ""what's $420 minus $420?""answer: what the saudis are willing to pay for $tslagood one, huh?",3,1,47,51
TSLA,Tesla Inc,1129104065185632256,pluginfud,2019-05-16,shorting $tsla since the day you lied about a fake buyout offer,1,3,31,35
TSLA,Tesla Inc,1129118627091877890,pluginfud,2019-05-16,now do $tsla,0,0,8,8
TSLA,Tesla Inc,1129122690856562689,markbspiegel,2019-05-16,"there's some kind of weird, potentially corrupt nhtsa cover-up going on regarding $tsla, as evidenced by this: https://thedrive.com/tech/26455/nhtsas-flawed-autopilot-safety-study-unmasked…is #tesla paying off (or blackmailing) someone @nhtsagov? this needs to be independently investigated.",13,16,97,126
TSLA,Tesla Inc,1129129341244313609,markbspiegel,2019-05-16,"my favorite, most appropriately named sec $tsla form has been filed:form ""pos""https://sec.gov/archives/edgar/data/1318605/000119312519149509/0001193125-19-149509-index.htm…",2,2,50,54
TSLA,Tesla Inc,1129142665340235776,markbspiegel,2019-05-16,"lol, the cfo will review and sign every outgoing payment for a $50b company!!!if you're an outside vendor doing any work at all for this shitshow, good luck getting paid!!!#tesla $tsla$tslaq",6,9,99,114
TSLA,Tesla Inc,1129144158407614466,markbspiegel,2019-05-16,"yes, note that q1 payables soared relative to revenue, which means at the current burn rate $tsla likely only has six months of cash.$tslaq",5,0,17,22
