ticker_symbol,company_name,tweet_id,writer,post_date,body,comment_num,retweet_num,like_num,reaction_total
TSLA,Tesla Inc,1131184883341156352,markbspiegel,2019-05-22,"""battery fires spark car carrier concern over green vehicles"" https://tradewindsnews.com/casualties/1786236/battery-fires-spark-car-carrier-concern-over-green-vehicles…pier 80 watchers: did $tsla use the grimaldi europa?",14,8,36,58
TSLA,Tesla Inc,1131185438696148992,gerberkawasaki,2019-05-22,as tons of fud and wall street attacks on tesla continue. it is hard to be a shareholder as this is not normal disruption like malls or cabs. these are trillion dollar industries that support countries.  this is the tesla war. it’s a was against carbon and #climatechange $tsla,66,87,568,721
TSLA,Tesla Inc,1131186726129393670,gerberkawasaki,2019-05-22,as our #climatecrisis continues to intensify. the scum of the world cheer hurting a 100% us company with 40k employees & the greatest innovation going on in the world. tesla is crucial to helping reverse the effects of #climatechange  $tsla,102,88,450,640
TSLA,Tesla Inc,1131186801144750080,teslacharts,2019-05-22,yeah it has nothing to do with institutions dumping $tsla at breakneck speed$tslaq,20,13,142,175
TSLA,Tesla Inc,1131187892250959873,pluginfud,2019-05-22,"keep making big calls, cabal$tsla $tslaq",2,0,7,9
TSLA,Tesla Inc,1131188165903994880,gerberkawasaki,2019-05-22,i’m happy to discuss tesla balance sheet. financials. everything. mono e mono on @cnbc any day of the week jim. enough talk. let’s do this. @jimcramer vs @gerberkawasaki live on #cnbc don’t be scared jim. calling you out. @elonmusk $tsla,104,51,424,579
TSLA,Tesla Inc,1131196357178535936,markbspiegel,2019-05-22,"in which $tsla and its model 3 remarkably resemble $gm, circa 1980:",0,0,7,7
TSLA,Tesla Inc,1131201319216275459,pluginfud,2019-05-22,today's bull topic of conversation$tsla $tslaq,5,1,25,31
TSLA,Tesla Inc,1131203680659791872,pluginfud,2019-05-22,"but, why buy a 75d f or $67,000 when you could get a 100d for $76,000?#tesladiscounts$tsla $tslaq",2,3,26,31
TSLA,Tesla Inc,1131204165609361408,pluginfud,2019-05-22,"and last of all, why buy a brand new 100d for $76,000 when you could get a 2 year old one with 24,000 miles on it for just $3,000 more ($6k more net of tax credit)$tsla $tslaq#tesladiscounts#markdownsondeck",6,2,26,34
TSLA,Tesla Inc,1131205230681575424,pluginfud,2019-05-22,"but wait, there's morewhy buy a brand new 100d for $76,000 or a two year old one for $79,000 when you could buy a one year old one (returned after 200 miles) for $90,000?$tsla $tslaq#inventoryrepricerwasfired#elonapproveseveryexpense#teslareversediscounts$tsla $tslaq",11,4,30,45
TSLA,Tesla Inc,1131205437859258368,markbspiegel,2019-05-22,translation: does $tsla need to do another massive inventory write-down in q2?,9,0,20,29
TSLA,Tesla Inc,1131209568032362499,pluginfud,2019-05-22,"- margins secured- model s dead- much less margin at higher end (bigger 100d price cuts, free luda, etc)@elonmusk, just pull the plug already bro$tsla $tslaq",0,0,6,6
TSLA,Tesla Inc,1131213022523994113,pluginfud,2019-05-22,considering buying a call to try to help us out here $tsla $tslaq,6,0,19,25
TSLA,Tesla Inc,1131216486935040001,vincent13031925,2019-05-22,added more $tsla today thanks for the nonsense low prices,53,42,494,589
TSLA,Tesla Inc,1131218691830571008,markbspiegel,2019-05-22,"just heard from someone on the ongoing morgan stanley $tsla call. to paraphrase:""jonas is shitting all over it. says it has too much debt & not enough revenue. fixed cost structure needs to sell 1m cars. if demand growth doesn't recover it's a restructuring story.""$tslaq",35,54,315,404
TSLA,Tesla Inc,1131219605085663233,pluginfud,2019-05-22,never stop shitting on $tsla till $tslaq and then we'll shit on @elonmusk for all eternity,3,1,30,34
TSLA,Tesla Inc,1131223137645932548,markbspiegel,2019-05-22,"from someone else on the ongoing morgan stanley $tsla call:""jonas is shockingly negative.""",11,7,107,125
TSLA,Tesla Inc,1131223751142641665,pluginfud,2019-05-22,"more from my friend on the morgan stanley $tsla call:""he (jonas) is in the restructuring camp.""",4,1,30,35
TSLA,Tesla Inc,1131225889147097088,pluginfud,2019-05-22,hey @elonmusk morgan stanley says $tsla should restructurewhat do you say to that?you really gonna let those short seller-backed analysts sht all over your company and hurt shareholders and believers in the mission?what a shame. i remember when you had a backbone.$tslaq,8,6,113,127
TSLA,Tesla Inc,1131229266920857600,pluginfud,2019-05-22,waiting for the short burn of the century likecc @elonmusk $tsla $tslaq,2,0,13,15
TSLA,Tesla Inc,1131229420121972737,markbspiegel,2019-05-22,but how would they be mashed together? even @ $10/share spacex would need to come up with $1.8b to buy $tsla plus $1.5b just to fund the next 12 months of losses. it just had a hell of a time raising just a few hundred million for itself!,1,1,8,10
TSLA,Tesla Inc,1131234375054630913,pluginfud,2019-05-22,unlimited demand secured#baggyrosecoloredglasses$tsla $tslaq,1,0,4,5
TSLA,Tesla Inc,1131236724145872896,pluginfud,2019-05-22,we about to get some red text or what?$tsla $tslaq,4,0,24,28
TSLA,Tesla Inc,1131237119576498176,pluginfud,2019-05-22,when the morgan stanley call leaks within hours of occurring...just file @elonmusk $tsla $tslaq,1,1,35,37
TSLA,Tesla Inc,1131237599681622017,pluginfud,2019-05-22,do an open market purchase zaddy @elonmusk $tsla $tslaq,2,0,10,12
TSLA,Tesla Inc,1131238811290296320,pluginfud,2019-05-22,"""no one cares about the debt as long as you're growing. but when questions are called into your growth, these numbers start to be noticed""$tsla $tslaq",0,0,9,9
TSLA,Tesla Inc,1131240518636244993,pluginfud,2019-05-22,"""does demand recover or not""prolly not tbhthoughts, @elonmusk $tsla $tslaq",0,0,5,5
TSLA,Tesla Inc,1131240706830475267,pluginfud,2019-05-22,"""yes, that's right, tesla, tech company... the auto industry's biggest restructuring story??""$tsla $tslaq",0,0,10,10
TSLA,Tesla Inc,1131240873583370240,pluginfud,2019-05-22,bull thesis$tsla $tslaq,4,0,11,15
TSLA,Tesla Inc,1131241979705286656,pluginfud,2019-05-22,it's the saudis!! thoughts @gerberkawasaki $tsla $tslaq,0,0,5,5
TSLA,Tesla Inc,1131243780923830273,gerberkawasaki,2019-05-22,the cr report on navigate on autopilot is somewhat legit. i find navigate on autopilot to be not as good as just using regular autopilot. i use regular autopilot everyday without issue. but i often don’t like the way navigate works.  this does need improvement. $tsla,11,1,25,37
TSLA,Tesla Inc,1131244272194244608,gerberkawasaki,2019-05-22,"on the other had. this in no way suggests that they will not be able to solve fsd. in fact a lot of fsd capabilities is hardware related, not just software. fsd is much further along than cr knows. i don’t think they’ve been in a fsd tesla like i have. it works pretty good $tsla",21,4,70,95
TSLA,Tesla Inc,1131244345183690752,pluginfud,2019-05-22,"""we're not going to be having this call later this year and saying model s/x refresh saved demand this year""damnthoughts @elonmusk $tsla $tslaq",0,1,16,17
TSLA,Tesla Inc,1131244842380480512,vincent13031925,2019-05-22,another great video from @bensullins about tesla with important data. thanks ben $tsla,4,25,134,163
TSLA,Tesla Inc,1131244865365467138,pluginfud,2019-05-22,"""tesla starting to advertise would be a disturbing development""$tsla $tslaq",1,0,12,13
TSLA,Tesla Inc,1131245925370925058,pluginfud,2019-05-22,"""i dont think price is a level""agree... they just keep cutting it... but sales have not woken up$tsla $tslaq",0,0,3,3
TSLA,Tesla Inc,1131247016510513152,vincent13031925,2019-05-22,please tell me who knows the company better than the ceo? @elonmusk $tsla,14,19,189,222
TSLA,Tesla Inc,1131247208794337282,pluginfud,2019-05-22,hey @sec_enforcement this blood is on your hands$tsla $tslaq,3,0,7,10
TSLA,Tesla Inc,1131247326524133376,gerberkawasaki,2019-05-22,this tesla  video spells it out pretty well. $tsla,2,6,54,62
TSLA,Tesla Inc,1131247470749593600,pluginfud,2019-05-22,its hard to believe the longs are actually this out of touch$tsla $tslaq,2,0,8,10
TSLA,Tesla Inc,1131248847030771714,pluginfud,2019-05-22,"regarding spacex ...""with a ceo that no one trusts""...damn @elonmusk you're gettin shidded on out here $tsla $tslaq",1,0,13,14
TSLA,Tesla Inc,1131253883295141889,pluginfud,2019-05-22,"not much else to be said about the morgan stanley / tesla call (quotes from it in prior tweets), but a few elmer terminal (likely misinformed) musings:https://dropbox.com/s/w6hz6iy4t4kvusp/tsla-morgan%20stanley%20call-5-22-19.mp3?dl=0…$tsla $tslaq",2,4,40,46
TSLA,Tesla Inc,1131253893252489216,pluginfud,2019-05-22,5 & fin. it aint over til the fat lady sings but it seems like she's at least reviewing her set list and warming up behind the scenes.$tsla $tslaq,3,0,32,35
TSLA,Tesla Inc,1131254678744981504,pluginfud,2019-05-22,"hey @elonmusk now's a great time for another one of your famous ""doesnt matter if we go bankrupt, we still helped bring about evs"" tweets$tsla $tslaq",3,0,30,33
TSLA,Tesla Inc,1131257613105160194,pluginfud,2019-05-22,"""realty check - autopilot is getting worse""https://reddit.com/r/teslamotors/comments/brpuu9/anti_hype_and_a_reality_check_autopilot_is/…cc @tashaark @cathiedwood @arkinvest @gfilche @elonmusk $tsla $tslaq",0,0,7,7
TSLA,Tesla Inc,1131259112216563713,pluginfud,2019-05-22,"your god-king, ladies and gentlemen $tsla $tslaq",0,0,8,8
TSLA,Tesla Inc,1131259373978882048,pluginfud,2019-05-22,"just imagine owning $tsla shares, down 50% from their peak, and the supposed genius god-king ceo is out here tweetin this",43,94,369,506
TSLA,Tesla Inc,1131260428305223681,pluginfud,2019-05-22,elmer terminal meme indicator remains flashing bright red and beeping annoyingly loudly $tsla $tslaq,0,0,7,7
TSLA,Tesla Inc,1131262655833026567,pluginfud,2019-05-22,i got the shitputs in the backhttps://youtube.com/watch?v=w2ov5jzm3j8…$tsla $tslaq,1,0,6,7
TSLA,Tesla Inc,1131267621599547392,pluginfud,2019-05-22,"**elmer terminal alert**the option writers have given us back our weekly $100 shtputs.not trading advice, obviously.(last time they did this was the dark days of last fall, when @elonmusk later admitted that tesla was days/weeks from death).$tsla $tslaq",3,0,20,23
TSLA,Tesla Inc,1131268615678955520,pluginfud,2019-05-22,never seent these kinda options offered on $tsla before...$tslaq#themms,2,0,17,19
TSLA,Tesla Inc,1131272009248321543,pluginfud,2019-05-22,sir @elonmusk we could really use some memes to calm the market rn$tsla $tslaq,0,0,5,5
TSLA,Tesla Inc,1131272125606768640,pluginfud,2019-05-22,sacrificial. i did it for my dawgs. $tsla $tslaq,5,0,24,29
TSLA,Tesla Inc,1131273387504914432,gerberkawasaki,2019-05-22,hitting up @cheddar tv. talking stocks and tesla. tune in now. on in a minute or two. $tsla,16,3,26,45
TSLA,Tesla Inc,1131274433719603201,pluginfud,2019-05-22,"dont worry $tsla longs, @elonmusk still has enough free time to like memes(note: i cannot see this like as the lovely poster has me blocked / he may have already liked it, but per my meme indicator sources, it did occur).$tslaq",1,0,10,11
TSLA,Tesla Inc,1131274754424483840,pluginfud,2019-05-22,these are 100% just for old time's sake. weekly 100 baggy shtputs. feels good man. $tsla $tslaq,2,0,22,24
TSLA,Tesla Inc,1131280420375392256,gerberkawasaki,2019-05-22,facts about safety. #tesla $tsla,15,3,74,92
TSLA,Tesla Inc,1131280530102738945,teslacharts,2019-05-22,spacex buying $tsla = fantasy^2$tslaq,17,3,77,97
TSLA,Tesla Inc,1131280786081112066,teslacharts,2019-05-22,jonas called $tsla's bailout of solarcity a controlled detonation. got it. welcome to $tslaq jonas.,16,18,244,278
TSLA,Tesla Inc,1131281207201865728,pluginfud,2019-05-22,shtput (and shtcall) prices are out of control $tsla $tslaq (now do $vix),0,0,8,8
TSLA,Tesla Inc,1131281521439068160,pluginfud,2019-05-22,soothing message to longs at this trying time$tsla $tslaq,1,0,18,19
TSLA,Tesla Inc,1131282560124891137,pluginfud,2019-05-22,gotta get a few more shtcalls after @elonmusk's winky face tweet$tsla $tslaq,6,0,9,15
TSLA,Tesla Inc,1131284445254901764,teslacharts,2019-05-22,adam jonas to @elonmusk today...$tsla $tslaq,6,5,87,98
TSLA,Tesla Inc,1131288811655372800,markbspiegel,2019-05-22,"""off the lows.""(my bob pisani $tsla impression.)",2,0,29,31
TSLA,Tesla Inc,1131299948446855173,pluginfud,2019-05-22,"ross's argument, litrly: ""but have you driven one bro""$tsla $tslaq",6,0,14,20
TSLA,Tesla Inc,1131300289275924480,pluginfud,2019-05-22,"""twitter is not fact. twitter is fud!""-@gerberkawasaki, 5/22/19$tsla $tslaq",1,0,29,30
TSLA,Tesla Inc,1131304993301172225,pluginfud,2019-05-22,god king genius @elonmusk if you don't give us some ambien'ed-out tweets tonight my baggy heart will be broken$tsla $tslaq,1,0,37,38
TSLA,Tesla Inc,1131306864166264832,pluginfud,2019-05-22,"thinking more about thisit screams that tesla very well could have had some outstanding but unrecorded payables...not an investable thesis, but what's gaap to a god-king?$tsla $tslaq",0,0,25,25
TSLA,Tesla Inc,1131357627483664386,pluginfud,2019-05-23,if you ever wanted to see the fakest of fake news:https://cleantechnica.com/2019/05/22/tesla-vancouver-store-reportedly-taking-in-800-tesla-model-3-orders-per-week/…$tsla $tslaq @cleantechnica should be sued.,13,2,20,35
TSLA,Tesla Inc,1131361917803606016,teslacharts,2019-05-23,how bad must things be under the hood at $tsla for jonas to think this call today was net litigation positive for $ms? #deepthoughts $tslaq,13,12,157,182
TSLA,Tesla Inc,1131364562903740416,pluginfud,2019-05-23,a tmc contributor's version of ark's model#notsellingasharebefore670$tsla $tslaq,3,0,8,11
TSLA,Tesla Inc,1131365493200187392,gerberkawasaki,2019-05-23,someone gets it. setting up for a huge opportunity. tesla just raised $2.7bil in a heartbeat.  they aren’t going anywhere. #tesla $tsla,10,15,155,180
TSLA,Tesla Inc,1131367021969416192,gerberkawasaki,2019-05-23,tesla vancouver store is reportedly taking in ~800 model 3 orders per week https://cleantechnica.com/2019/05/22/tesla-vancouver-store-reportedly-taking-in-800-tesla-model-3-orders-per-week/…,23,23,171,217
TSLA,Tesla Inc,1131369687504379909,pluginfud,2019-05-23,"same bro. in the past few days ive gotten a few texts from irl people w/ screenshots of cnbc articles shiddinon elon and tesla going ""wow maybe you werent wrong after all""$tsla $tslaq",3,1,26,30
TSLA,Tesla Inc,1131376286675423234,pluginfud,2019-05-23,i had the same general thought today but didn't want to tweet it first.for all of @elonmusk's farces clearly he saw this end game and 1) tried to silence truth tellers and 2) tried to avoid the inevitable via a fraudulent fake buyout offer.$tsla $tslaq,1,0,14,15
TSLA,Tesla Inc,1131382542894940161,gerberkawasaki,2019-05-23,the fud merchants told you they couldn’t raise money.  they were wrong. they told you the sec would jail musk. they were wrong. they said they would run out of money. wrong again. now they say people around the world don’t want evs. they’re wrong. hang in there tesla fans. $tsla,98,108,851,1057
TSLA,Tesla Inc,1131387008901713920,gerberkawasaki,2019-05-23,amazon ceo jeff bezos shares insights on rivian's $700 million investment. read this closely. no one needs ev vehicles more than amazon. $amzn $tsla  https://apple.news/afp8b3pfuq36cwnnpcywwha…,10,7,54,71
TSLA,Tesla Inc,1131398034913452032,pluginfud,2019-05-23,said differentlymodel 3 sales in the rest of the entire united states were only about 15k in q1. sad @elonmusk $tsla $tslaq,3,1,19,23
TSLA,Tesla Inc,1131402579878002689,pluginfud,2019-05-23,"i'd like to think this is satire, but i think it's actually serious$tsla $tslaq$space $spaceq$bore $boreq",5,3,26,34
TSLA,Tesla Inc,1131410909426061312,pluginfud,2019-05-23,"@model3owners my tesla repair shop has received 4 right fender for my model 3 all of the damaged beyond repair when they arrived. tesla is shipping them with no packaging, so seems like an easy fix and a way to save thousands.",4,0,8,12
TSLA,Tesla Inc,1131449436356448257,pluginfud,2019-05-23,no wonder why the tutes are liquidating.$tsla $tslaq @elonmusk,0,0,5,5
TSLA,Tesla Inc,1131449690782932992,pluginfud,2019-05-23,you laughing and smoking a joint while $tsla burns in the background? cool dawg,1,0,0,1
TSLA,Tesla Inc,1131449794759733248,pluginfud,2019-05-23,so happy i stayed up late tonight@elonmusk lets do a live bull vs bear debatei'll be the bull$tsla $tslaq,2,0,12,14
TSLA,Tesla Inc,1131454902088036353,vincent13031925,2019-05-23,"may 23rd 2019, tesla attended to china international new energy vehicle cooperation conference 2019.$tsla #tesla #china #teslachina #ev",2,8,65,75
TSLA,Tesla Inc,1131459562706391040,vincent13031925,2019-05-23,chinese media reports:tesla v3 super charging will officially enter the chinese market by the end of this year (2019).$tsla #tesla #china #teslachina #v3supercharging,4,21,157,182
TSLA,Tesla Inc,1131471703249477632,pluginfud,2019-05-23,$tsla might sell 75k cars this quarter,0,0,10,10
TSLA,Tesla Inc,1131475951542575105,teslacharts,2019-05-23,they aren’t going to move on $tsla with s&p sitting two notches higher,2,0,1,3
TSLA,Tesla Inc,1131528190982279168,markbspiegel,2019-05-23,"plus (and this is very important!), this erin gibbs from s&p is the most supercute $tsla bear i've yet seen!",4,0,15,19
TSLA,Tesla Inc,1131529429593862144,markbspiegel,2019-05-23,"attention @andrewrsorkin, this is a line directly from p.88 of the $tsla 10-k:""we incurred marketing, promotional and advertising costs of $70.0 million in the year ended december 31, 2018.""looking forward to your correction!",2,4,42,48
TSLA,Tesla Inc,1131535231083831296,pluginfud,2019-05-23,guyssame game plan as yesterdaysave the eternal excitement for post lunch$tsla $tslaq,7,0,31,38
TSLA,Tesla Inc,1131538028617457664,markbspiegel,2019-05-23,"lol, the math doesn't even add up. $tsla supposedly exited q1 with 10k cars in transit and no backlog. if it exits q2 with 5k in transit (for ""in-transit net deliveries"" of 5k), then delivers the supposed 50k new orders it's 55k model 3s. throw in 15k s/x & it's 70k cars in total",8,7,29,44
TSLA,Tesla Inc,1131542387178840064,pluginfud,2019-05-23,hey @elonmusk if you guys really have taken in 50k orders this quarterwhy do you keep slashing prices?$tsla $tslaq,11,5,115,131
TSLA,Tesla Inc,1131542748673269760,markbspiegel,2019-05-23,"if $tsla had no backlog, why is 50,000 quarterly orders considered ""good,"" lol?",2,0,22,24
TSLA,Tesla Inc,1131550886738612226,gerberkawasaki,2019-05-23,"tesla on track to beat q4 2018's record deliveries, claims leaked elon musk emails. this will be very interesting. opportunity rarely knocks twice. $tsla #tesla  https://apple.news/acbne0yngtymtgzfubsn5wa…",31,43,299,373
TSLA,Tesla Inc,1131551510876135426,gerberkawasaki,2019-05-23,"tales from a tesla model s with 450,000 miles: battery life, durability, and more. we know this car. we’re investor’s in tesloop. it’s real. $tsla #tesla  https://apple.news/aidfea9bsrlaymg3avgxqaq…",2,5,55,62
TSLA,Tesla Inc,1131554212247031809,gerberkawasaki,2019-05-23,china won’t be too bad this qtr.  but we do need a better situation than the current trade war to have an idea about the future.  yet to be seen if china demand changes. $tsla,0,1,35,36
TSLA,Tesla Inc,1131555198655225856,pluginfud,2019-05-23,hey @elonmusk if leaked emails don't workjust tweet it directly brosec won't do anything$tsla $tslaq,2,1,70,73
TSLA,Tesla Inc,1131556507068166144,vincent13031925,2019-05-23,this is very very interesting. $tsla #tesla,11,31,184,226
TSLA,Tesla Inc,1131558481780023296,vincent13031925,2019-05-23,"tesla shanghai gigafactory 3  now officially hiring, congratulation to @elonmusk & @tesla team $tsla #tesla #china #teslachina #gf3",33,190,0,223
TSLA,Tesla Inc,1131560670376292352,gerberkawasaki,2019-05-23,see watch the sacred shorts cover. cover guys. make your money. $tsla,60,10,140,210
TSLA,Tesla Inc,1131563701528453120,vincent13031925,2019-05-23,"update about tesla gf3  hiring: chinese media: #tesla shanghai gigafactory 3 will open a special job fair on may 29, involving 25 positions in 6 departments, including press shop, welding shop, painting shop, assembly shop, facility operation, and logistics department. $tsla",5,49,204,258
TSLA,Tesla Inc,1131565783090442240,pluginfud,2019-05-23,one thing $tsla and $tslaq can agree on,1,7,67,75
TSLA,Tesla Inc,1131569380528218112,pluginfud,2019-05-23,"while @elonmusk tries to pumpdon't let him distract you from the fact that the former cash cows model s & x are only being produced at a 1,000/week combined rate.$tsla $tslaq",3,3,38,44
TSLA,Tesla Inc,1131578320976527362,pluginfud,2019-05-23,elon musk might be the dirtiest ceo of all time.,1,0,6,7
TSLA,Tesla Inc,1131578935882506241,markbspiegel,2019-05-23,"really? $tsla ""has been somewhat accurate on deliveries""? what was the q1 guidance?",1,0,11,12
TSLA,Tesla Inc,1131602188671836160,pluginfud,2019-05-23,long $yum short $tsla,2,0,17,19
TSLA,Tesla Inc,1131604935634771968,markbspiegel,2019-05-23,"""tesla: growing competition dooms it to being a small unprofitable player"" https://thestreet.com/investing/stocks/tesla-growing-competition-small-and-unprofitable-player-14970655…this is the core of $tsla 's problem. the fact that its ceo happens to be a sociopath & pathologically lying, drug abusing securities fraudster is really just a humorous side show!",7,11,59,77
TSLA,Tesla Inc,1131610023879217153,markbspiegel,2019-05-23,"""liquidation"" creates cash; new production sold below cost burns it. however you raise an important point: due to massive price cuts/much lower asps, any incremental q2 $tsla sales over q1 will be profitaless. thus, excluding one-time items, q2 gaap loss will roughly equal q1's.",1,0,2,3
TSLA,Tesla Inc,1131613524688560128,pluginfud,2019-05-23,"*puts on pretending i know about the stock market dynamics hat*well, with >20 million shares traded today, pretty much everyone who wants to buy, sell, cover, or short based on elon susly reaffirming guidance has done so.next news nugget pls, @elonmusk $tsla $tslaq",3,2,49,54
TSLA,Tesla Inc,1131625339334135808,pluginfud,2019-05-23,how long until $tsla is out of money again?,0,0,13,13
TSLA,Tesla Inc,1131659882342625287,pluginfud,2019-05-23,hey @elonmusk if vancouver tesla is swamped with 800 orders a week and 2 month delivery waits why are salespeople desperately calling customers for more?$tsla $tslaq,0,4,31,35
TSLA,Tesla Inc,1131666657968046081,pluginfud,2019-05-23,"today in the tesla tale that never ends, we learn that ""some cars were forgotten"" at a ""delivery hub"" during a ""labor strike"" (in regards to a buyer about to buy a summer 2018-build model 3)any comment @elonmusk $tsla $tslaq",5,3,25,33
TSLA,Tesla Inc,1131667980885143552,pluginfud,2019-05-23,now do $tsla,0,0,25,25
TSLA,Tesla Inc,1131672285969100800,teslacharts,2019-05-23,"alternative headline?"" $tsla knowingly sold significantly more cars than it was prepared to service in norway in q1, defrauding customers ""$tslaq",0,7,68,75
TSLA,Tesla Inc,1131707011802943488,vincent13031925,2019-05-23,but but but all media and analysts told me that tesla has no demand... reality: now tesla model 3 is also dominating in austria  $tsla #tesla #model3 #austria,16,34,235,285
TSLA,Tesla Inc,1131729192272326657,vincent13031925,2019-05-24,"i won’t order a tesla model y if i am not happy with my model 3. i won’t referral my friends if i am not happy with my model 3. a good product will sell by itself, and generate sustainable demand. $tsla #lifetimecustomer #tesla",7,16,219,242
TSLA,Tesla Inc,1131731724034019328,pluginfud,2019-05-24,"for the recordelmer terminal finger in the air $tsla deliveries prediction for q2 is75,420.$tslaq",14,5,73,92
TSLA,Tesla Inc,1131739457542131712,pluginfud,2019-05-24,10-15k s/x10-20k 3 europe5-10k 3 china40-50k 3 ustake it to the bankthe bank of shortsvillebecause if they deliver this they'll still deliver yuge losses and disappoint the street$tsla $tslaq,6,1,30,37
TSLA,Tesla Inc,1131758842335944709,pluginfud,2019-05-24,that's 420 above the high end of coverdrive guidance. it's been a difficult week for me as i discover that jonas is a bear and elmer is a bull. someone help me get my feet grounded.,0,0,2,2
TSLA,Tesla Inc,1131770189140430848,pluginfud,2019-05-24,50%. brutal.kinda like zaddy $tsla i guess,1,0,1,2
TSLA,Tesla Inc,1131791262447788038,pluginfud,2019-05-24,thanks for sharing. #sgf we need these kinda reports.supports my general feeling that $tsla has dwindling model 3 inventory / pent up deliveries in us as they've made cars for international markets until about now.$tslaq,1,0,2,3
TSLA,Tesla Inc,1131850097950679040,teslacharts,2019-05-24,watching british politicians pretend like they want #brexit while doing everything they can to stall it is like watching @sec_enforcement pretend to regulate $tsla,4,4,113,121
TSLA,Tesla Inc,1131867315094659072,teslacharts,2019-05-24,"the very best way to cut costs is to not bloat up in the first place. ego boy needed to sell growth, market expectations and economic value creation be damned. it doesn't do any good to create unsustainable jobs. make no mistake - $tsla is primarily a leadership failure story.",12,13,151,176
TSLA,Tesla Inc,1131895064198819840,markbspiegel,2019-05-24,"i have no idea if this is true but the account has been around since 2012 and seems to pick up chinese news headlines from various sources and post them in english. regardless, the only way that factory would open before 2020 anyway is if $tsla ships a line there from fremont.",4,0,18,22
TSLA,Tesla Inc,1131897083806588928,markbspiegel,2019-05-24,hey @plainsite see if you can find a lien against $tsla from charmin.,3,0,29,32
TSLA,Tesla Inc,1131904251200802817,gerberkawasaki,2019-05-24,this could be one of the coolest things to show tesla’s ev dominance and the #model3 growth. $tsla,110,801,0,911
