ticker_symbol,company_name,tweet_id,writer,post_date,body,comment_num,retweet_num,like_num,reaction_total
TSLA,Tesla Inc,1131906270187986944,pluginfud,2019-05-24,"i love my model 3 but yeah autopilot & navigate on autopilot can be weird sometimes, so always stay alert.95% of the time it’s fine, but i don’t trust it with lane merges. here it literally let lady in then wanted to ram her so i took over @electrekco @fredericlambert @teslarati",0,1,3,4
TSLA,Tesla Inc,1131914066522464256,pluginfud,2019-05-24,who would ever work for this company and this deranged god-king$tsla $tslaq,5,3,30,38
TSLA,Tesla Inc,1131923038168076289,pluginfud,2019-05-24,thats my girl$tsla $tslaq,3,0,7,10
TSLA,Tesla Inc,1131925900184956928,pluginfud,2019-05-24,"for the not late night, 4 margaritas deep crowd... thoughts? elmer terminal enjoys processing any new information. $tsla $tslaq",3,0,8,11
TSLA,Tesla Inc,1131929809041416193,pluginfud,2019-05-24,"they still have coffee but they have to pay for it now, caught this on blind the other week. $tsla",0,0,7,7
TSLA,Tesla Inc,1131942102718451713,pluginfud,2019-05-24,time to leak another email @elonmusk $tsla $tslaq,3,0,27,30
TSLA,Tesla Inc,1131949297711239170,vincent13031925,2019-05-24,another great reason to get your @tesla today with the @sce clean fuel reward program in california. also receive 5000 free supercharging miles with my referral code below: http://ts.la/vincent68747tesla model 3 lease payment starting at $399/month (be4 saving) $tsla,0,8,48,56
TSLA,Tesla Inc,1131950041038565378,pluginfud,2019-05-24,scoopette after tesla slashed prices on the model s and x earlier this weekout of ~950 100d model s's listed in us inventoryonly ~50 do *not* have an incremental #tesladiscounts on top of that. endless inventory under $80k (vs $85k fake starting price).$tsla $tslaq,2,1,18,21
TSLA,Tesla Inc,1131951447241891841,pluginfud,2019-05-24,"same story in the netherlands.list price of eur 88k.out of 400 model s 100d in inventory, only ~10 aren't below list price. $tsla $tslaq#tesladiscounts",2,0,9,11
TSLA,Tesla Inc,1131953566854385667,pluginfud,2019-05-24,"dirt-flavored @tashaark and @arkinvest now see $tsla's pt as not $4,000/share but $5,900/share.$tsla $tslaq",3,0,5,8
TSLA,Tesla Inc,1131956959572299776,pluginfud,2019-05-24,"scoopette:along with cutting bathroom expenses, tesla has now (apparently), in an effort to reduce expenses, started to classify a greater amount of issues with their shoddily-built cars as ""within spec"" to avoid repair costs.brand destruction 101 er 420. $tsla $tslaq",5,8,49,62
TSLA,Tesla Inc,1131974661716234241,pluginfud,2019-05-24,hey @sec_enforcement daily reminder via a baggy that you're a disgrace$tsla $tslaq,6,2,31,39
TSLA,Tesla Inc,1131977815698616320,pluginfud,2019-05-24," lowest price that i've ever seen on a new tesla model s 100d $63,000.margins secured.https://teslamotorsclub.com/tmc/threads/this-time-actually-i-bought-a-ms.153780/…$tsla $tslaq",11,9,79,99
TSLA,Tesla Inc,1131991875869708289,markbspiegel,2019-05-24,"one slight correction to this terrific article: $tsla in fact no longer claims it will be cash-flow positive later this year; it recently said that won't happen until the ""autonomous robotaxis"" are deployed, lol.$tslaq",6,2,48,56
TSLA,Tesla Inc,1131993138770468865,pluginfud,2019-05-24,"brb securing some ""what if zach has a few shtbeers this weekend and has a long honest conversation with himself and decides that life would be a lot better if he wasn't ap manager & fraud cover-upper ii at tesla anymore"" puts$tsla $tslaq",1,0,16,17
TSLA,Tesla Inc,1131994712041283584,markbspiegel,2019-05-24,"""tesla starts limiting charge to 80% at busy superchargers to reduce wait times"" https://electrek.co/2019/05/24/tesla-limiting-supercharger-busy/…sorry $tsla drivers... you'll have to walk those last 60 miles!",12,15,71,98
TSLA,Tesla Inc,1131995100601606144,pluginfud,2019-05-24,did the options writers get a whiff of the party pack that @elonmusk purchased for mdw? options are more expensive than around er right now. yeesh. $tsla $tslaq,4,1,12,17
TSLA,Tesla Inc,1131999225825366017,pluginfud,2019-05-24,been a while since i looked at oi but blue horseshoe really loves june shtputs $tsla $tslaq,6,0,6,12
TSLA,Tesla Inc,1132003912603570178,pluginfud,2019-05-24,"dear tesla abl lendersmake your non-accountant cfo zachy get someone in there to reprice used inventory. tesla sold a brand new 100d for $63,000. the attached car is not worth $62,000.$tsla $tslaq",7,10,55,72
TSLA,Tesla Inc,1132004956062535682,pluginfud,2019-05-24,wait lets go to california (not that many used teslas in new york since we dont f with em in general)used 2017s w/ miles for >$80k or brand new 2019s for <$80k.this is a shtshow. $tsla $tslaq,7,9,42,58
TSLA,Tesla Inc,1132005393830416384,markbspiegel,2019-05-24,"sounds as if that ""one-time"" $tsla inventory write-down in q1 is about to be a ""two-timer""!$tslaq",1,0,14,15
TSLA,Tesla Inc,1132006328078094338,pluginfud,2019-05-24,bull thesis$tsla $tslaq,0,0,5,5
TSLA,Tesla Inc,1132007710457761792,pluginfud,2019-05-24,"god-king-genius-truth teller @elonmusk says: tesla vehicles appreciatereal life says: actually, this model 3 depreciated 30% in less than one year.why must you continue to lie elon? $tsla $tslaq",4,0,16,20
TSLA,Tesla Inc,1132012020595875843,pluginfud,2019-05-24,"did this get lost in the shuffle?""2015 tesla accelerated into a wall""https://teslamotorsclub.com/tmc/threads/2015-tesla-accelerated-into-a-wall.153603/…$tsla $tslaq",5,1,8,14
TSLA,Tesla Inc,1132013696270635011,pluginfud,2019-05-24,ok @elonmusk market is closed you can announce some layoffs or something now$tsla $tslaq,4,0,33,37
TSLA,Tesla Inc,1132015559250460672,pluginfud,2019-05-24,being short $tsla since @elonmusk started waging war on the shorts,0,0,3,3
TSLA,Tesla Inc,1132016108356214784,pluginfud,2019-05-24,being plain short $tsla equity,1,1,21,23
TSLA,Tesla Inc,1132017272908910593,pluginfud,2019-05-24,where's the safest place for $tsla shareholders to seek refuge right now,10,2,52,64
TSLA,Tesla Inc,1132020756387368960,pluginfud,2019-05-24,i'm tuning in$tsla $tslaq,2,0,4,6
TSLA,Tesla Inc,1132066551459405830,pluginfud,2019-05-24,eating good off your recent $tsla short i see,0,0,0,0
TSLA,Tesla Inc,1132076446116192257,teslacharts,2019-05-25,fun fact: “at $0 per share $tsla is still 50% overvalued” paraphrasing jonas on the best call ever$tslaq,8,20,189,217
TSLA,Tesla Inc,1132080951507464194,teslacharts,2019-05-25,"it must be said, so i will say it. @cathiedwood is without question a very intelligent person. but you can’t say what she says about $tsla and believe it. it is just such obvious bullshit. she’s been buying all the way down. it must be getting quite desperate. good luck cathie.",54,11,182,247
TSLA,Tesla Inc,1132211945170395140,vincent13031925,2019-05-25,tesla shanghai gigafactory video from youtube channel jason yangmay 20th 2019$tsla #tesla #china #teslachina #gf3,4,27,157,188
TSLA,Tesla Inc,1132338004910071809,teslacharts,2019-05-25,exactly this. please retweet widely. $tslaq $tsla cc @melissaleecnbc @timseymour @arkinvest @cathiedwood @tashaark @beckyquick,1,45,96,142
TSLA,Tesla Inc,1132339780706979840,vincent13031925,2019-05-25,"data show that in march 2019, global ev sales increased by 53% yoy to more than 224k units. 1st quarter of 2019, global ev sales increased by 58% yoy & successfully exceeded 500k units. china's ev sales accounted for half of the global total sales of evs. $tsla #tesla #china #gf3",4,50,245,299
TSLA,Tesla Inc,1132341305714008064,vincent13031925,2019-05-25,"according to ev sales data, the sales volume of the tesla model 3 in the european market reached 15,800 units in march this year. with the launch of the model 3 sr/sr+ version, it is believed that the sales volume of the model 3 will be continuously increased in the future. $tsla",8,13,98,119
TSLA,Tesla Inc,1132351543255150594,pluginfud,2019-05-25,your social media presence is nearly 100% spacex as you've grown bored of red-headed stepchild tesla since there's no more big dreams or pumping on the horizon.you owe it to $tsla shareholders (who you promised to protect) to replace yourself with a ceo who isn't distracted.,6,4,34,44
TSLA,Tesla Inc,1132373369641246720,vincent13031925,2019-05-25,"largest #tesla supercharging station in south china, shenzhen iot internet industrial park was officially opened to the public. the park also has multi-purpose conference hall, tea room, lounge & convenience store, so that you can wait while charging. $tsla #teslachina #china",8,18,144,170
TSLA,Tesla Inc,1132376334016163841,pluginfud,2019-05-25,hey @elonmusk are yall bringing back the fugly model s nose cone?$tsla $tslaq,7,0,26,33
TSLA,Tesla Inc,1132385491385499650,markbspiegel,2019-05-25,i agree $tsla sentiment suddenly seems bearish but don't forget it still has an enterprise value >$40b +billions in non-debt liabilities & hemorrhages losses with no improvement. sentiment was bullish for a long time& bearishness can exist the same way as stuckholders slowly exit,3,1,6,10
TSLA,Tesla Inc,1132385811968811008,markbspiegel,2019-05-25,eventually $tsla stock will reach fair value and bearishness & bullishness will be equally matched. that will happen at $0.00.,1,0,11,12
TSLA,Tesla Inc,1132389981736112129,markbspiegel,2019-05-25,great for the new electric vws... bad for $tsla.,3,2,44,49
TSLA,Tesla Inc,1132418381745930240,pluginfud,2019-05-25,"$tsla shares are down $100 since @elonmusk commissioned the classic tune ""rip harambe""where were the signs / where was the board.$tslaq",4,3,65,72
TSLA,Tesla Inc,1132445909474840584,markbspiegel,2019-05-26,"""tesla boss elon musk is running out of road now is rivals have woken up"" https://thetimes.co.uk/edition/business/tesla-boss-elon-musk-is-running-out-of-road-now-is-rivals-have-woken-up-q58bg978j…in which ""the times of london"" uses the $tsla - palm analogy. (sorry, i don't have a subscription to post the whole article. i only buy british papers with topless photos in them.)",4,2,34,40
TSLA,Tesla Inc,1132446776030617601,teslacharts,2019-05-26,now do something about $tsla. or stop stealing your salary from taxpayers.,0,0,20,20
TSLA,Tesla Inc,1132459486172590086,teslacharts,2019-05-26,virtually no $tsla bull will understand the critical importance of this chart. most $tslaq will... trade carefully,11,3,64,78
TSLA,Tesla Inc,1132468729302978560,pluginfud,2019-05-26,$tsla $tslaqme: hey god-king whatcha up to this weekend@elonmusk:,1,0,9,10
TSLA,Tesla Inc,1132472557494505472,teslacharts,2019-05-26,"in case you haven't noticed, when a $tsla bull attacks me or says something really dumb in response to one of my tweets, i've decided to respond with ""thanks for your money"", and move on. i suggest you do the same. they were very kind to give us this opportunity. $tslaq",9,4,216,229
TSLA,Tesla Inc,1132515751238262784,pluginfud,2019-05-26,my take: model 3 deliveries of 13.5k in may and 23k in june (lots of unfulfilled orders in the tracker rn). production still largely international. intl sellthru will make or break q2.thanks dean and all of #sgf for what you do. keep the reports coming.$tsla $tslaq,4,1,22,27
TSLA,Tesla Inc,1132534135078236160,pluginfud,2019-05-26,#sgf san diego update. cali running hot.$tsla $tslaqand throw this mans a follow,0,0,4,4
TSLA,Tesla Inc,1132540843791921154,pluginfud,2019-05-26,"q2 push in china  order long range tesla model 3 in china before may 31st and delivered before june 30th receive fsd for free worth 56,000rmb. plus 7500km free supercharging.#tesla #teslachina #model3 #china #特斯拉 #中国 $tsla",5,1,23,29
TSLA,Tesla Inc,1132601115034439680,markbspiegel,2019-05-26,"i'm raising my estimate to 76k (from 75k the other day), as i'm guessing the new incentives in canada (c$5k federal + c$5k in bc or c$8k in quebec, but only on sr+ for the federal c$5k) will be good for 1000 more cars than i previously thought. for $tsla though, it's profitless.",2,0,8,10
TSLA,Tesla Inc,1132604442933682176,markbspiegel,2019-05-26,"so if $tsla reports 90k cars (vs my current 76k estimate) in early july could the stock pop before the earnings report causes its final death spiral? maybe, if the market is oblivious to asps. my personal feeling is ""so what?""; i've waited 5 years; i can wait a few extra weeks.",13,3,88,104
TSLA,Tesla Inc,1132607004353204226,markbspiegel,2019-05-26,"for $tsla the game's (losing) score is pre-ordained but i don't know for sure when the clock runs out, so i'll wait; i'm very patient.",1,0,5,6
TSLA,Tesla Inc,1132612277167902721,markbspiegel,2019-05-26,"one last point (not a question): what we're seeing in california with may $tsla m3 sales is clearly (based on observation in nv, co, ma & ny) not being replicated on a national level, and is thus likely due to the expiration of hov lane stickers on all pre-2017 model year evs.",2,0,1,3
TSLA,Tesla Inc,1132618320593805312,markbspiegel,2019-05-26,"final point for now re $tsla q2: those of you wondering ""where all the production went"" shouldn't forget this: https://cnbc.com/2019/05/02/tesla-adds-employee-loan-benefit-workers-describe-unpredictable-hours.html…",1,0,14,15
TSLA,Tesla Inc,1132633108195319808,gerberkawasaki,2019-05-26,central u.s. reels as severe weather claims 10th victim in a week. the death toll from severe weather grows. #climatechangeisreal #climatecrisis #tesla $tsla,1,0,3,4
TSLA,Tesla Inc,1132641087560962048,gerberkawasaki,2019-05-26,change is coming to the #ice makers. the pressure builds as people want change.  #ev adaption is growing exponentially. #climatecrisis #tesla $tsla,3,1,23,27
TSLA,Tesla Inc,1132644432820391937,gerberkawasaki,2019-05-26,people want change. they are tired of extreme weather. the loss of life and pain from #climatechange - all of us must ask ourselves what can we do to help. plant a tree. buy an ev. support renewable energy.  #hawaii #tesla $tsla #sundaythoughts,21,12,109,142
TSLA,Tesla Inc,1132665547689271298,pluginfud,2019-05-26,another angle.additional q2 sale secured.$tsla $tslaq,11,5,56,72
TSLA,Tesla Inc,1132673672995590144,pluginfud,2019-05-26,"lol of the day:tesla just days ago sold a brand new, <50 mile model s (at a firesale price)that had been sitting around since december 2017.$tsla $tslaq",12,6,58,76
TSLA,Tesla Inc,1132679586897113088,pluginfud,2019-05-26,"weekend conversation on the @teslamotorsclub investors thread:everyone's pumped up for the coming along shanghai gigglefactory, which apparently is going to make 30,000 cars per week.$tsla $tslaq",5,3,37,45
TSLA,Tesla Inc,1132751380148625411,pluginfud,2019-05-26,"what appears to be yet another tesla slaughterpilot crash, this time in switzerland.$tsla $tslaq",6,25,59,90
TSLA,Tesla Inc,1132961164781064193,teslacharts,2019-05-27,"hypothesiscritically and counterintuitively, the ongoing steady state 'flow' demand for $tsla model 3 variants shrinks as they go down market. global flow demand (i.e. q3 2019 and beyond) will look like this: awd>lr rwd>sr+. prove me wrong.(ps this is a huge deal)$tslaq",28,11,104,143
TSLA,Tesla Inc,1132992691128528897,gerberkawasaki,2019-05-27,young people blame climate change for their small retirement accounts. they don’t believe there will be a long term. #climatecrisis #tesla $tsla,7,2,11,20
TSLA,Tesla Inc,1132994016348295168,gerberkawasaki,2019-05-27,"china’s electric vehicle sales may increase 27 per cent this year to a record, as their popularity offsets slumping demand for cars. china is committed to an ev future. #tesla #climatecrisis $tsla",5,17,109,131
TSLA,Tesla Inc,1132997529207918593,gerberkawasaki,2019-05-27,memorial day weekend in ca turns deadly after 18 people killed in crashes. a massacre on ca highways as faulty human drivers die in ice vehicles. we need #autonomous driving now! #tesla #autopilot saves lives. $tsla,33,33,175,241
TSLA,Tesla Inc,1133026306432675840,markbspiegel,2019-05-27,"if one wants to look at seemingly meaningful monthly mas for $tsla, the one that held on a closing basis multiple times until the recent breakdown was the *50*-month moving average. that has now been obliterated. see the yellow line below. (the 100-month is the magenta line.)",1,0,11,12
TSLA,Tesla Inc,1133036021749358594,markbspiegel,2019-05-27,"it's not clear that plug-in hybrids aren't the most practical solution- the infrastructure exists & they eliminate nearly all the most important emissions. but now ""science"" is taking a back seat to ""politics"" in all this shit, so who knows? all i know is $tsla won't survive.",1,0,2,3
TSLA,Tesla Inc,1133038946705969153,pluginfud,2019-05-27,"god-king @elonmusk nuking management, line employees, suppliers, customers, and other various barnacles and saboteurs on his never ending quest to burn the shorts$tsla $tslaq",1,0,14,15
TSLA,Tesla Inc,1133042271484633088,pluginfud,2019-05-27,god-king @elonmusk on the topic of whether he did securities fraud$tsla $tslaq,0,0,10,10
TSLA,Tesla Inc,1133046532020867072,pluginfud,2019-05-27,"my q2 s/x/3 delivery estimate was 74k since early may. https://twitter.com/troyteslike/status/1123851587263389697…after the email, 76k looks more likely.",1,2,10,13
TSLA,Tesla Inc,1133052210324094979,pluginfud,2019-05-27,"this is not the first time i've seen something about ""car that's not supposed to be sold to the public""why tho?$tsla $tslaq",3,1,19,23
TSLA,Tesla Inc,1133062998732357632,vincent13031925,2019-05-27,tesla china event on may 31st 2019stay tuned!! $tsla #tesla #china #teslachina,28,58,346,432
TSLA,Tesla Inc,1133074295268302848,markbspiegel,2019-05-27,"again, based on reports from all you ""ground force"" guys, it seems the only significant may tesla sales pick-up is in california (which, as was pointed out, is actually kind of bearish as $tsla tends to leave those sales for last, after shipping to meet demand everywhere else).",3,0,7,10
TSLA,Tesla Inc,1133088388918026240,vincent13031925,2019-05-27,tesla everywhere here in tustin capeople just love #tesla #demandproblem $tsla,4,5,122,131
TSLA,Tesla Inc,1133110165669072902,teslacharts,2019-05-27,"1/ as a service to my loyal followers, i present a quick analysis of what the credit markets are telling us about $tsla's future. h/t to @glenntongue for being patient with my amateurish questions. $tslaq",16,78,329,423
TSLA,Tesla Inc,1133110166579306496,teslacharts,2019-05-27,2/ we begin with a look at the long-term liabilities of $tsla as shown in the q1-2019 10q. the benchmark bond was issued in 2017 and $1.8b comes due in august of 2025 $tslaq,3,2,43,48
TSLA,Tesla Inc,1133110170949545986,teslacharts,2019-05-27,"4/ which means it has a yield to maturity of 9.2%, which is remarkable for a company with $tsla's market cap.  $tslaq",1,2,65,68
TSLA,Tesla Inc,1133110172853899264,teslacharts,2019-05-27,5/ that yield of 9.2% is more than 700 basis points higher than comparable treasury notes. the credit market is questioning $tsla's solvency. big time. $tslaq,2,9,84,95
TSLA,Tesla Inc,1133110178461696000,teslacharts,2019-05-27,"8/ how bad are these numbers? let's compare them to $gm, an automaker with ev offerings and an autonomy division. the closest bond to $tsla's benchmark is a $500mm note that matures in april of 2025. it is priced at $100.5 with a coupon of 4%. $tslaq",1,2,50,53
TSLA,Tesla Inc,1133110181993308160,teslacharts,2019-05-27,10/ and a spread to treasuring of only 177 basis points (compared to >700 for $tsla). $gm $tslaq,1,1,44,46
TSLA,Tesla Inc,1133110185134895104,teslacharts,2019-05-27,"12/that five year cds is in the middle of where it has traded in the past year. clearly, the credit markets are screaming about $tsla. and yet, $tsla's equity is valued at a price-to-sales ratio of 1.5 versus only 0.34 for $gm. $tslaq",2,2,66,70
TSLA,Tesla Inc,1133110186988724224,teslacharts,2019-05-27,"13/ moving on, and to quote @jkylebass, a rolling loan collects no loss. $tsla has a $165mm term loan due in june, and presumably after the recent raise they will pay this note on time and in full. $tslaq",1,1,56,58
TSLA,Tesla Inc,1133110188905361410,teslacharts,2019-05-27,"14/ now things get very interesting. $tsla has a $566mm solarcity convertible bond due on november 1, 2019. $tslaq",1,2,60,63
TSLA,Tesla Inc,1133110200456699905,teslacharts,2019-05-27,"18/ and a ridiculous spread to treasuries of 1,445 bp! what is the credit market telling us about $tsla's plans for solarcity? will they try to isolate solarcity from the mother ship? $tslaq",1,5,69,75
TSLA,Tesla Inc,1133110205900820481,teslacharts,2019-05-27,"21/ here is the one-year chart as well. like all of $tsla's credit, it has traded lower since the raise. $tslaq",1,1,42,44
TSLA,Tesla Inc,1133110209235345408,teslacharts,2019-05-27,23/ the drop from ~105 at issue to 87.75 on friday is from a combination of the stock price drop (lowering the value of the embedded call option) and the deteriorating credit confidence in $tsla. $tslaq,1,2,50,53
TSLA,Tesla Inc,1133110210946580480,teslacharts,2019-05-27,"24/ finally let's note that $tsla has other big bills to pay. despite the sales and production decline observed in q1, its accounts payable plus accrued liabilities stayed flat at $5.5b. the march 31 $5.5b was probably a little more urgent than the december 31 $5.5b, no? $tslaq",2,3,65,70
TSLA,Tesla Inc,1133110213458956288,teslacharts,2019-05-27,"25/ so there you have it. $tsla credit markets are screaming solvency risk, while the equity still sells at 4.4 times the valuation of $gm.  trade carefully. tc out. $tslaq",26,10,245,281
TSLA,Tesla Inc,1133112838388477952,vincent13031925,2019-05-27,does this video show some true color of the (some) media & wallst analysts $tsla #tesla,12,69,381,462
TSLA,Tesla Inc,1133125373330436098,teslacharts,2019-05-27,if you don't follow @glenntongue you should. i suspect his expertise will come in handy in the coming weeks and months. $tsla $tslaq,8,8,62,78
TSLA,Tesla Inc,1133129520922484736,vincent13031925,2019-05-27,"another great vid from @gfilche, well done brotoyota prius took 10 yrs to achieve what tesla model 3 has done in just couple of years. must watch$tsla #tesla",0,9,88,97
TSLA,Tesla Inc,1133137999884013569,vincent13031925,2019-05-27,tesla chengdu china  experience center anniversary!! $tsla #tesla #china #teslachina,0,3,62,65
TSLA,Tesla Inc,1133161439793950722,teslacharts,2019-05-28,"bump.let's get glenn into the 1,000 follower club.you won't regret it.$tsla $tslaq",7,0,36,43
TSLA,Tesla Inc,1133166372492587008,pluginfud,2019-05-28,god-king-genius @elonmusk manages to get on the bad side of yet another area of expertise thanks to his arrogance and wrongness.$tsla $tslaq,0,1,22,23
TSLA,Tesla Inc,1133180623089274881,pluginfud,2019-05-28,scopette@elonmusk appears to adjust tesla q2 units guidence from 90-100k to 74kor did he?thanks for helping keep this ambiguity going @sec_enforcement $tsla $tslaq,13,19,98,130
TSLA,Tesla Inc,1133192232654258177,pluginfud,2019-05-28,"new (for me) @tesla model 3 glitch. trip a, trip b & since last charge screens stopped metering, went to zero. no change in 15 miles. i verified the main odometer still clicks over, so we’re ok for dmv purposes. steering button reboot procedure cleared it. odd.",0,0,6,6
TSLA,Tesla Inc,1133193509073248257,pluginfud,2019-05-28,fresh model 3 glitch - car is completely bricked! no keys recognized!not a tech companynot a car companyjust a shtcompany @elonmusk$tsla $tslaq,9,9,56,74
TSLA,Tesla Inc,1133201036561326080,markbspiegel,2019-05-28,"so we can thus draw one of two conclusions from this little escapade. either:1) musk just took $tsla guidance to 74,000 or2) musk is making material tweets without approval.either way it's a win for $tslaq.",8,8,89,105
TSLA,Tesla Inc,1133339916857937920,teslacharts,2019-05-28,unfortunately the author knows nothing about $tsla,0,0,3,3
TSLA,Tesla Inc,1133343697758826496,markbspiegel,2019-05-28,"so this implies that ""first edition"" cars are the ones built this fall and will probably be delivered in early 2020. the pricing on these id.3s (thanks to vw's massive scale and willingness to initially lose money on them) will put a ton of pressure on $tsla model 3 sales.",0,0,3,3
TSLA,Tesla Inc,1133345553356644352,markbspiegel,2019-05-28,"before using the phrase ""already dominating"" you may want to look at what the i-pace & e-tron have done to sales of the $tsla s&x in europe, then consider what the smaller electric polestars, audis, bmws, mercedes, etc. will soon do to the money-losing model 3. or don't, cultboy.",1,0,1,2
TSLA,Tesla Inc,1133350698555514880,markbspiegel,2019-05-28,"$nio: ""looking ahead to the 2nd quarter we expect an even more challenging sales environment & anticipate overall sequential demand & deliveries to decrease as competition accelerates & the general automobile market in china remains muted"" https://globenewswire.com/news-release/2019/05/28/1851146/0/en/nio-inc-reports-unaudited-first-quarter-2019-financial-results.html…ugly for $tsla",4,7,44,55
TSLA,Tesla Inc,1133353888394956800,pluginfud,2019-05-28,another day in the life of an @elonmusk beta tester / owner of the bestest car ever$tsla $tslaq,2,3,26,31
TSLA,Tesla Inc,1133357159922561024,gerberkawasaki,2019-05-28,big automakers are grudgingly buying into evs — but oil majors still lag behind - #tesla $tsla,0,3,13,16
TSLA,Tesla Inc,1133359443205189637,gerberkawasaki,2019-05-28,the ipace isn’t the nicest looking jaguar out there. but the interior is nice. the car goes 250 miles (supposedly) and runs for over $70k. #tesla $tsla,8,1,18,27
TSLA,Tesla Inc,1133359903714684928,gerberkawasaki,2019-05-28,the ipace is a nice luxury ev. although it can’t compare to the tesla model s or x on any level.  it’s a nice ev. the legacy car makers have no tech in their evs. they are taking the same cars and making them ev. $tsla,4,4,71,79
