ticker_symbol,company_name,tweet_id,writer,post_date,body,comment_num,retweet_num,like_num,reaction_total
AAPL,apple,1123390744750768129,gerberkawasaki,2019-05-01,thoughts on apple and innovation from #cnbc today. check it out. i’m towards the end. it was hot. @cnbc $aapl,5,4,18,27
AAPL,apple,1123410437469433857,gerberkawasaki,2019-05-01,in time. disney will prove the best model. if you look at ip monetization per viewer enjoyment. disney can leverage it exponentially in movies parks merchandise and then streaming. $dis vs $nflx $aapl,6,4,44,54
AAPL,apple,1123410824477827072,gerberkawasaki,2019-05-01,apple is trying to be the gate keeper. they will give you some over produced shows if you login through them. they hope to take a toll on the apps like hbo disney etc. $aapl vs $dis $nflx,1,0,8,9
AAPL,apple,1123411103239696384,gerberkawasaki,2019-05-01,apple ultimately will not stop people from signing up around them or taking a lower toll to get users.  disney is in the best position needing no one and owning half the production in hollywood. $aapl $dis $nflx,0,3,14,17
AAPL,apple,1123412436076208128,gerberkawasaki,2019-05-01,and poor apple left out in the cold with some oprah and spielberg feel good dramas. $aapl,0,0,2,2
AAPL,apple,1123583247324205056,markbspiegel,2019-05-01,"i have no $aapl position but i really like @tommythornton 's short call there, just because no one else does, lol.",2,0,19,21
AAPL,apple,1123586652683661312,gerberkawasaki,2019-05-01,stocks start higher today led by apple’s not so great earnings report. i guess not as bad as feared is worth $10 higher.  we’ll take it. $aapl,4,1,8,13
AAPL,apple,1123654431738867713,gerberkawasaki,2019-05-01,hey @elonmusk i’ve heard @tim_cook is giving a class on how to spin your stock to new highs with all numbers going down. i highly recommend it. happy to review with you this talent tim has. $tsla $aapl,92,32,344,468
AAPL,apple,1124787521525899265,gerberkawasaki,2019-05-04,same with $nvda and it’s an amazing company. and activision and ea. $ea $atvi it’s normal for tech stocks actually. apple was at $140 just a few weeks ago. $aapl,2,0,4,6
AAPL,apple,1125002990073417729,gerberkawasaki,2019-05-05,tim paying homage to his new boss. $brk $aapl,3,4,30,37
AAPL,apple,1128003042656153603,gerberkawasaki,2019-05-13,heading to @foxbusiness to talk about the trade war and apple. giving some thoughts on $aapl at 12 noon. tune in. $aapl #china #chinatariffs,3,2,9,14
AAPL,apple,1128017135060508672,gerberkawasaki,2019-05-13,"take it back, wrong time. sorry. i’ll be on @foxbusiness at 12:50 pst. tune in for my thoughts on apple’s issues and the market. #tradewar #china #appletv $aapl",1,2,7,10
AAPL,apple,1128286724063252486,gerberkawasaki,2019-05-14,apple app store policies is an antitrust issue. facebook should be broken up. amazon and google need to follow fair advertising policies. it’s a new era for faang. (netflix has plenty of competition) $aapl $nflx $amzn $goog $fb,2,3,7,12
GOOG,Google Inc,1128286724063252486,gerberkawasaki,2019-05-14,apple app store policies is an antitrust issue. facebook should be broken up. amazon and google need to follow fair advertising policies. it’s a new era for faang. (netflix has plenty of competition) $aapl $nflx $amzn $goog $fb,2,3,7,12
AMZN,Amazon.com,1128286724063252486,gerberkawasaki,2019-05-14,apple app store policies is an antitrust issue. facebook should be broken up. amazon and google need to follow fair advertising policies. it’s a new era for faang. (netflix has plenty of competition) $aapl $nflx $amzn $goog $fb,2,3,7,12
AAPL,apple,1128840246139842560,gerberkawasaki,2019-05-16,apple has done zero studies on these issues. but these things can’t be good for you. sorry.  #airbuds $aapl,8,0,6,14
AAPL,apple,1129435285442326528,gerberkawasaki,2019-05-17,seems like a good use of shareholder funds after a year of amazing innovation..... #apple has fallen from the tree $aapl,9,3,20,32
AAPL,apple,1130472314636648448,gerberkawasaki,2019-05-20,apple is a much bigger issue.... $aapl,4,0,11,15
AAPL,apple,1130968117373542401,pluginfud,2019-05-21,dealmakers at tmc investors forum be like...$tsla $aapl $googl,6,0,14,20
TSLA,Tesla Inc,1130968117373542401,pluginfud,2019-05-21,dealmakers at tmc investors forum be like...$tsla $aapl $googl,6,0,14,20
AAPL,apple,1131385297806061568,gerberkawasaki,2019-05-23,faang could take a bite into tesla. gene is right about this. tesla is now vulnerable to a take out and has regular voting shares. ⁦@tim_cook⁩ must have noticed. $tsla $aapl $amzn $goog,14,3,30,47
GOOG,Google Inc,1131385297806061568,gerberkawasaki,2019-05-23,faang could take a bite into tesla. gene is right about this. tesla is now vulnerable to a take out and has regular voting shares. ⁦@tim_cook⁩ must have noticed. $tsla $aapl $amzn $goog,14,3,30,47
TSLA,Tesla Inc,1131385297806061568,gerberkawasaki,2019-05-23,faang could take a bite into tesla. gene is right about this. tesla is now vulnerable to a take out and has regular voting shares. ⁦@tim_cook⁩ must have noticed. $tsla $aapl $amzn $goog,14,3,30,47
GOOG,Google Inc,1126104206954250240,gerberkawasaki,2019-05-08,you can now order a waymo with your lyft app. if you’re in phoenix. in a small area. going on a preset route. if you get one of the 10 cars. been preselected by google in advance. and don’t say anything about the experience. sounds like it’s ready..... $goog $lyft,9,7,41,57
AMZN,Amazon.com,1123412283785220096,gerberkawasaki,2019-05-01,i simple solution is people will keep netflix and buy a hulu with live tv bundle with disney+ and espn. people get amazon with prime. they might hbo free with att too. $t $dis $nflx $amzn,4,0,9,13
AMZN,Amazon.com,1123660844208926722,pluginfud,2019-05-01,"also, ross, the other company to complain about in this equation is $amznthe name of the game for internet slicksters has been to find the now white labeled, stolen ip products on $baba, rebrand, and sell on $amzn.amzn has started to crack down, but they enabled too.",1,0,11,12
AMZN,Amazon.com,1124136537619353600,gerberkawasaki,2019-05-03,what is going on. first apple and now amazon. is warren on cbd ? good call though. $amzn,11,6,27,44
AMZN,Amazon.com,1124310950117564416,gerberkawasaki,2019-05-03,amazon sprinting higher because someone in buffett’s office bought a growth company. berkshire well underperforming the index this year. $amzn $brk,8,1,17,26
AMZN,Amazon.com,1124314930251956224,gerberkawasaki,2019-05-03,if warren buffett is buying amazon and the public is buying beyond meat. safe to say we’re in a bull market.  $amzn $brk $bynd,12,5,98,115
AMZN,Amazon.com,1125208258543853569,markbspiegel,2019-05-06,"i'm watching ""the next 3 days"" on $amzn & it's the most unbelievable movie i've ever seen...not because crowe is singlehandedly breaking banks out of jail, but because every single young mom in this dumpy little pa town is a supermodel...they should call it ""the next 3 milfs""!",1,0,12,13
AMZN,Amazon.com,1125753259681935360,gerberkawasaki,2019-05-07,"$9 bil more for what? keep losing money on rides. fend off lyft and others. scooters, failed foreign expansions. a delivery platform? hello. that’s amazon. #uber $amzn",2,1,5,8
AMZN,Amazon.com,1127567199873458177,markbspiegel,2019-05-12,"but wal-mart only has free 2-day shipping with a $35 minimum purchase. for a while they were cheaper than $amzn on most household goods, but now amazon is cheaper on most (but not all) daily-use things.",1,0,0,1
AMZN,Amazon.com,1131248288617967616,pluginfud,2019-05-22,"""bezos described the rivian ceo as the 'most impressive missionary that he's ever seen in business'... and that's god! telling you that""ok i've had enough of this slander. @elonmusk is the only true god-king. $tsla $tslaq $amzn",2,0,9,11
AMZN,Amazon.com,1132716388697534464,gerberkawasaki,2019-05-26,walt disney corporation up 21% ytd. amazon up 25% ytd. microsoft up 25% ytd. $dis $msft $amzn,23,8,94,125
MSFT,Microsoft,1132716388697534464,gerberkawasaki,2019-05-26,walt disney corporation up 21% ytd. amazon up 25% ytd. microsoft up 25% ytd. $dis $msft $amzn,23,8,94,125
AMZN,Amazon.com,1134453436668268545,gerberkawasaki,2019-05-31,#amazon wireless .... $amzn,3,0,4,7
TSLA,Tesla Inc,1123381704356442118,pluginfud,2019-05-01,"what happens if insideevs us numbers, official european numbers, and china estimates don't total to ""the best first month ever""? asking for, uh, myself$tsla $tslaq",7,1,57,65
TSLA,Tesla Inc,1123392736818794496,markbspiegel,2019-05-01,"you know in just this one sale reported tonight, $tsla cto straubel sold roughly 5% of his entire holdings in the company. think about that.",12,20,115,147
TSLA,Tesla Inc,1123426124246085632,gerberkawasaki,2019-05-01,no big deal. contempt of court. lol. #tesla $tsla,5,10,51,66
TSLA,Tesla Inc,1123450145264340992,pluginfud,2019-05-01,remember when they said this about elizabeth holmes@elonmusk $tsla $tslaq,1,0,10,11
TSLA,Tesla Inc,1123554216159666177,pluginfud,2019-05-01,the message uk tesla model 3 reservers are getting this morning... guess that's what happens when you've fired all your web staff$tsla $tslaq,4,11,55,70
TSLA,Tesla Inc,1123558214119972864,markbspiegel,2019-05-01,"here's a link to our april fund letter, courtesy of @seekingalpha : https://seekingalpha.com/article/4258380-stanphyl-capital-letter-april-2019…we came into the month (and remain) very heavily net short.$tsla, $wstl, $avnw, $dba, $ycs, $bndx, $sq, $nflx, $cvna, $iwm",2,5,21,28
TSLA,Tesla Inc,1123575593382088704,pluginfud,2019-05-01,"not new news, but always fun to point out this pathetic execution by @elonmusk:$tsla has sold thousands of $60,000+ cars that did not come with the ""included"" $xxx spoiler, and months to almost one year later, there is still no promises of installing them anytime soon.$tslaq",4,2,30,36
TSLA,Tesla Inc,1123576783926910976,pluginfud,2019-05-01,"""dammit greg, which part supplier cut us off this week""$tsla $tslaq",1,1,19,21
TSLA,Tesla Inc,1123579168309043201,pluginfud,2019-05-01,"lets take a moment to remember that the @ftc and other regulators have allowed the god-king @elonmusk to sell a product called ""full self driving"" for years that ""do[es]"" not make the vehicle autonomous""gonna be so sweet when this fraud is all over, one day.$tsla $tslaq",2,6,45,53
TSLA,Tesla Inc,1123593281294802945,pluginfud,2019-05-01,$tsla theme music:,6,0,9,15
TSLA,Tesla Inc,1123599360783200257,pluginfud,2019-05-01,how ya feelin this morning @elonmusk?$tsla -> $tslaq,1,0,13,14
TSLA,Tesla Inc,1123600936331612161,teslacharts,2019-05-01,"in the nine quarters since the solarcity 'acquisition' (q1-17 to q1-19), here's what $tsla has delivered:revenue: $37.7bnet income/loss: -$4.0b (-10.5%)automotive regulatory credits sold: $1.0bstock based compensation recognized: $1.4b$tslaq",3,16,82,101
TSLA,Tesla Inc,1123604217300758529,pluginfud,2019-05-01,me when the $tsla longs slide in the dms and i have to tell em to kick rockshttps://youtu.be/by-iozdbjpu?t=232…,2,0,5,7
TSLA,Tesla Inc,1123606733967044608,pluginfud,2019-05-01,hey @elonmusk stop fake-respecting the shortseller enrichment commission and give us a nice pumpy tweet!at this point your share-loan-givers might even encourage it. $tsla $tslaq,2,0,29,31
TSLA,Tesla Inc,1123608111573397504,gerberkawasaki,2019-05-01,apple keeps climbing. $130 bil in net cash and no idea how to spend it. $10 bil gets you around 20% of tesla. imagine... we could get iphones with a full day of battery life and a charging mat! $aapl $tsla,69,42,425,536
TSLA,Tesla Inc,1123612327356583937,pluginfud,2019-05-01,"chock one up for the elmer terminal, but most importantly all sgf enlistedmen who called this right on the nose.10,050 model 3825 model s1,050 model x(cc @teslacharts)$tsla $tslaq",16,11,93,120
TSLA,Tesla Inc,1123612410831626240,teslacharts,2019-05-01,"never been happier to be wrong. a no good, terrible, disastrous month for $tsla in the us. let's see the raise bro.$tslaq",10,26,121,157
TSLA,Tesla Inc,1123613407192784897,pluginfud,2019-05-01,"in light of the insideevs us april delivery figures of 12,000 total teslas as well as the known ~4,000 in europeand perhaps 6,000 (or even 10,000 in china - doesnt really matter)it's very safe to call $tsla's q1 call guidance of >90,000 q1 deliveries fraudulent.$tslaq",9,7,54,70
TSLA,Tesla Inc,1123614469446426625,teslacharts,2019-05-01,look at this chart. and then consider how terrible the mix is for the red bars compared to the grey bars. can we agree that 90-100k isn't going to happen? $tslaq $tsla,32,38,178,248
TSLA,Tesla Inc,1123621626279538688,markbspiegel,2019-05-01,"lol, just when i thought i was almost out of the mob (one way or another, $tsla is done), wework is dragging me back in!",8,2,74,84
TSLA,Tesla Inc,1123626519455248385,pluginfud,2019-05-01,looks like this is going to become a daily thing$tsla $tslaq,5,0,26,31
TSLA,Tesla Inc,1123643324706033664,pluginfud,2019-05-01,"dear people considering giving $tsla much needed capital:last time you did that,@elonmusk used it to build a new production line that he said would make 10,000 $35k model 3's per weekin reality it can make 5,000 $50k model 3's/weekwhich represents excess capacity.$tslaq",6,2,67,75
TSLA,Tesla Inc,1123647235928072193,pluginfud,2019-05-01,hey @ntsb @nhtsagov you're a total joke. @elonmusk has made a total mockery of you.$tsla $tslaq,2,1,21,24
TSLA,Tesla Inc,1123651099632787462,gerberkawasaki,2019-05-01,guess the la times didn’t see that fiat paid tesla hundreds of millions for credits weeks before earnings. even though they reported that news. then they act like tesla hid it. really? $tsla,10,0,67,77
TSLA,Tesla Inc,1123659775345143808,pluginfud,2019-05-01,see @elonmusk file chapter 11. you'll get to keep a lil piece of $tsla for yourselfand then $tslaq will rise like a phoenix and you'll be richer than ever before you know it,0,0,8,8
TSLA,Tesla Inc,1123668867853766658,pluginfud,2019-05-01,hey @cgasparino can we get a  re: tesla's would-be financiers laughing at the prospect of raising money following onto a blown-out april and q2 forecast merely one week after tesla made it?$tsla $tslaq,1,1,14,16
TSLA,Tesla Inc,1123683742231486464,pluginfud,2019-05-01,"he speaks of $tsla as i imagine he would a $1b baby sv unicorn: all that matters to him is product, users, trajectory, etc. plus, sv blinders = ""everyones buying one bro""difference is, at $50b ev & public co $tsla, financial results + liquidity actually (are starting 2) matter.",0,0,7,7
TSLA,Tesla Inc,1123702227674202112,pluginfud,2019-05-01,"whats crazy is that finished goods inventory at q1-19 represented >30,000 car-equivalentsok, maybe 10-15k were on boats or just landed in china and europe.... but we should be seeing a glut in the us if that figure is real.$tsla $tslaq",0,0,10,10
TSLA,Tesla Inc,1123710345812631553,pluginfud,2019-05-01,"tbh, probably just a sideshow.1) $tsla employs a dir. of corp dev, he's gotta twiddle his thumbs2) its free (non-cash), so why not3) @elonmusk can use it to pump4) but, i doubt the tech is actually amazing or else they would have found another offer during go-shop period",1,0,5,6
TSLA,Tesla Inc,1123801579726036994,pluginfud,2019-05-02,"scoopette:just now, the god-king @elonmusk blesst the non-traitors robyn, kathleen, and back from spring break steve with some fresh shares. (form 4s out)h/t dm slider$tsla $tslaq",2,1,15,18
TSLA,Tesla Inc,1123912068342734849,teslacharts,2019-05-02,"remember. there’s the law, and then there’s teslaw. let’s see the raise. $tslaq $tsla",3,0,43,46
TSLA,Tesla Inc,1123914626431950848,markbspiegel,2019-05-02,"so the lead underwriter on the $tsla deal has a ""sell"" on the stock and a $200 price target.",12,34,234,280
TSLA,Tesla Inc,1123915394853625857,markbspiegel,2019-05-02,"so musk's total margin loan balance is down to $507 million? where (drawing no tesla salary) did he get the hundreds of millions of dollars to reduce it from the previous balance, as well as put $100m into boring co. and buy tens of millions in $tsla stock and pay the sec $20m?",5,1,32,38
TSLA,Tesla Inc,1123918478002610180,markbspiegel,2019-05-02,"it'll be hilarious to see people get snookered into buying this deal, then find out in exactly 60 days that $tsla missed the mid-point of q2 guidance by 30,000 cars.",12,9,95,116
TSLA,Tesla Inc,1123922852103823362,markbspiegel,2019-05-02,"anyone buying this $tsla deal will get severely snookered in 60 days when tesla misses the q2 delivery guidance midpoint by 30k cars. i'm surprised the i-banks will underwrite this without a guidance revision. hey banks: on behalf of any dummy who buys this deal,you're on notice!",5,8,55,68
TSLA,Tesla Inc,1123923852667564037,markbspiegel,2019-05-02,"no, i've never seen a deal with so many underwriters that have ""sell"" ratings and price targets below the offering. as with anything else with $tsla, this is a first, lol!",3,3,40,46
TSLA,Tesla Inc,1123924569830699008,markbspiegel,2019-05-02,"when $tsla reports approximately 65,000 q2 deliveries in exactly 60 days, the lawsuits will be epic and every bank on that cover will be part of them.",17,8,79,104
TSLA,Tesla Inc,1123925791455182851,markbspiegel,2019-05-02,"these $tsla deal buyers won't be ""fundamental."" they'll be ""predatory.""",1,0,9,10
TSLA,Tesla Inc,1123929710197657601,markbspiegel,2019-05-02,"$tsla will burn around $1.5b just in operations this year, before repaying any debt or spending anywhere near its projected capex. this is a band-aid on the path to oblivion.",7,6,68,81
TSLA,Tesla Inc,1123934373504593920,pluginfud,2019-05-02,i hate to be a negative nancybut if this does go off as planned tonight i imagine we'll round trip back to aths tbh$tsla $tslaq,19,2,23,44
TSLA,Tesla Inc,1123935075224182785,markbspiegel,2019-05-02,"shirley, you're joking!i've said for a long time that if $tsla announces a deal the stock will have a short-lived pop of $10-$20, then resume its gradual trip to oblivion.",5,0,31,36
TSLA,Tesla Inc,1123935465516748802,markbspiegel,2019-05-02,a friend just got a $tsla offering email from his retail broker at fidelity. that tells you all you need to know.,19,33,226,278
TSLA,Tesla Inc,1123936100387627009,pluginfud,2019-05-02,"i hope you're right, but i think this is gets $tsla back to business as usual (musk bumbling around burning money promising future that never comes) which meant stock between 275-325. with cash in the bank doesn't matter that model 3 was a bust - y, semi and roadster coming bro",6,0,7,13
TSLA,Tesla Inc,1123937758433697799,markbspiegel,2019-05-02,"so last fall musk bought $20m of $tsla shares at >$300/share. why at the ""bargain price"" (as everything continues to ""ramp""!) in the $230s is he only buying $10m worth?",15,9,85,109
TSLA,Tesla Inc,1123940307337453573,markbspiegel,2019-05-02,"okay, whatever you say. the way i (and most institutions now) see it, $tsla can keep the lights on for another 9 months while losses pile up and demand dwindles, and the next deal prices 30% lower...but hey, that's what makes a market!",5,3,26,34
TSLA,Tesla Inc,1123942924541136901,gerberkawasaki,2019-05-02,lol. tesla pulls off the capital raise with no problem.  shorts are f-cked. lol. told you they weren’t going anywhere. $tsla,133,60,545,738
TSLA,Tesla Inc,1123946210992250882,gerberkawasaki,2019-05-02,"good call @elonmusk banking some capital now to keep tesla growing fast and properly funded. great timing too, as people clamor to buy the beyond meat ipo. #tesla $tsla",12,10,126,148
TSLA,Tesla Inc,1123948107220307969,gerberkawasaki,2019-05-02,of course the fud sellers are pissed. “tesla finds a few dollars to avoid bk” sound like the headlines. happy to see tesla being prudent. $tsla,8,3,68,79
TSLA,Tesla Inc,1123950598657908738,gerberkawasaki,2019-05-02,of course i’m told goldman sachs is leading the financing for tesla. expect an upgrade soon after their short clients cover.  $tsla,12,8,112,132
TSLA,Tesla Inc,1123950830774824960,gerberkawasaki,2019-05-02,also keep in mind tesla will pay little in interest in the offering vectors stock and some convert debt. elon is also buying in. $tsla,10,5,55,70
TSLA,Tesla Inc,1123952500678250496,markbspiegel,2019-05-02,$650m of stock is very small relative to $tsla trading volume. my best guess is $230.$tslaq,5,0,11,16
TSLA,Tesla Inc,1123957056992681984,pluginfud,2019-05-02,"god-king @elonmusk owes ~$500m to wall street. to the ppl that track this, is this higher/lower/in-line with expectations? $tsla $tslaq",3,0,10,13
TSLA,Tesla Inc,1123959377331990530,pluginfud,2019-05-02,will be interesting to see how $tsla trades after this takes place $tslaq,1,0,8,9
TSLA,Tesla Inc,1123961524673032193,markbspiegel,2019-05-02,"no, $2.3b does not ""support the narrative of the company."" the operating cash flow loss alone will be at least $1.2b this year and tesla also has around $700m of term & convertible debt due.$tsla",2,0,1,3
TSLA,Tesla Inc,1123979692099371009,markbspiegel,2019-05-02,"i understand the $tsla deal call was unintentionally hilarious-- all about ""appreciating cars"" and this deal raising a ""cushion"" that probably won't be spent.$tslaq#underwriterlawsuitsq",13,12,95,120
TSLA,Tesla Inc,1123980739987542016,pluginfud,2019-05-02,"it doesnt change those things, but it delays any reckoning. idk how one can say $tsla having $2b more in its bank account tomorrow than it does today is good for the not-bulls.",2,0,3,5
TSLA,Tesla Inc,1123983733554593792,pluginfud,2019-05-02,some rehashing of thoughs as i think some of you were worried that i was going to jump in front of the e train this morning (and others are unwilling to take a little l here)... $tsla $tslaq,2,0,10,12
TSLA,Tesla Inc,1123983735697833984,pluginfud,2019-05-02,"but liquidity issues, specifically, the working capital deficit, was the acute condition that put $tsla in the hospital with doctors starting to mumble that it may be time to think about the hospice instead.",1,0,7,8
TSLA,Tesla Inc,1123983741855182848,pluginfud,2019-05-02,"so that's it. i think longs deserve to breath a sigh of relief & i think $tslaq can admit to itself that this helps tesla in short-medium term.if your thesis is $tsla is $50b ev & should *eventually* be $15b, thesis unchanged.if it was ""wow they're running on fumes"", it does.",5,3,22,30
TSLA,Tesla Inc,1123996535698677761,gerberkawasaki,2019-05-02,why tesla raised money. get this china giga up and producing cars. $tsla,11,9,63,83
TSLA,Tesla Inc,1123997020463730688,gerberkawasaki,2019-05-02,tesla knew it was time to strike. ipo market a bit frothy don’t you think. super smart move @elonmusk $tsla,3,1,20,24
TSLA,Tesla Inc,1123998802199887872,gerberkawasaki,2019-05-02,"i’m one of the only people in the world, and one of the first to take a ride in a fsd tesla.  i know a lot more about how it works than almost all of you. doubt @elonmusk all you want. the tech works pretty well already. you will see soon... $tsla",119,106,797,1022
TSLA,Tesla Inc,1124002052437364737,pluginfud,2019-05-02,i had this thought as well. $tsla better do everything it can to make >90k units in q2-19 happen,9,5,36,50
TSLA,Tesla Inc,1124024090564747266,markbspiegel,2019-05-02,"to be fair, i *don't* know how to analyze this benford data and it may be meaningless. but it's often used so i'm throwing it out there re $tsla.",0,0,2,2
TSLA,Tesla Inc,1124025319835545601,markbspiegel,2019-05-02,"""the tesla equity raise: fool us again, elon!"" https://thestreet.com/investing/stocks/tesla-equity-raise-elon-musk-fool-me-again-14947009… ""tesla's ceo says the capital raise is all about its autonomous robotaxi fleet, but the prospectus doesn't mention a word about it.""$tsla$tslaq",7,39,148,194
TSLA,Tesla Inc,1124030188080246784,markbspiegel,2019-05-02,"i *so* want to short more $tsla here +$10 after reading about that blatantly fraudulent investor call, but fuck it, we have a huge position and will just ride it down to $0.00 over time.",15,4,110,129
TSLA,Tesla Inc,1124065272548265985,markbspiegel,2019-05-02,"""tesla $tsla ceo musk said autonomy could make tesla a $500b company - bloomberg""i didn't think *any* company could lose $500 billion, but yes, i suppose with $tsla it's possible!",2,3,67,72
TSLA,Tesla Inc,1124072478521921536,markbspiegel,2019-05-02,which will $tsla bring us first:,4,1,5,10
TSLA,Tesla Inc,1124141494452011008,markbspiegel,2019-05-03,"on the back of my envelope, i estimate that despite raising $2.3b today, $tsla will end q2 with only $300m more on the balance sheet than it ended q1; i.e., around $2.5b. combined q3 & q4 fcf will be around -$1.5b + around $750m of debt is due. $tsla is 100% out of cash on 12/31.",3,5,50,58
TSLA,Tesla Inc,1124142324248907776,markbspiegel,2019-05-03,"these are rough numbers give or take a few hundred million, but in right around 6 months $tsla will be back at the till (with its back once again against the wall)  looking for billions more to keep the lights on and the jet fueled.",10,2,47,59
TSLA,Tesla Inc,1124151297274413057,markbspiegel,2019-05-03,"for fraud-boy's conference call nonsense wouldn't $tsla have to put out a ""free writing prospectus"" covering what he said, then wait 24 hours (or something like that) before the deal is done?",5,3,29,37
TSLA,Tesla Inc,1124277239472885760,markbspiegel,2019-05-03,"i'm currently guessing $tsla delivers around 67,000 cars in q2, but of course that estimate changes as the quarter unfolds. most importantly, inclusive of last night's raise i think tesla is almost completely out of cash at the end of q4... as in, close to $0.00.",0,0,4,4
TSLA,Tesla Inc,1124285318805508097,markbspiegel,2019-05-03,"clearly, @sec_enforcement is doing its job of educating naive investors by allowing them to pay some ""tuition."" meanwhile $tsla will be completely out of cash in approximately eight months and the next raise will be lower and uglier.$tslaq",0,0,12,12
